2009,5,"SALES IN ALL GEOGRAPHIC REGIONS EXCEPT JAPAN SHOWED MONTH-TO-MONTH GAINS - SIAAMD and Learning Games Network Sponsor A-ha Moment Video Contest <AMD.N>AMD Releases WHQL Certified Graphics Driver For Windows 7 on Day One of Windows 7 Logo Program <AMD.N>AMD Tightens Organization Focus on Microprocessor and Graphics Innovation and Platform Leadership <AMD.N>AMD <AMD.N> SAYS RANDY ALLEN, SENIOR VICE PRESIDENT, COMPUTING SOLUTIONS GROUP, HAS DECIDED TO LEAVE THE COMPANYBRIEF-AMD says senior VP to leaveAMD Technology Delivers the Ultimate Visual Experience to Customers Running Windows 7 Release Candidate <AMD.N>UPDATE 1-EU exec set to fine Intel on May 13FACTBOX-Five facts on Intel vs AMD rivalryTIMELINE-Intel's antitrust battle with the EUINSTANT VIEW 2-EU exec slaps record antitrust fine on IntelFACTBOX-UPDATE 1-Intel's rivalry with AMDAMD Comments on European Commission Ruling that Intel Violated EU Law and Harmed Consumers <AMD.N>AMD COMMENTS ON EUROPEAN COMMISSION RULING THAT INTEL VIOLATED EU LAW AND HARMED CONSUMERSUPDATE 3-EU fines Intel 1 bln euros for squeezing out rivalBRIEF-AMD comments on European commission rulingUPDATE 4-EU fines Intel 1 bln euros for squeezing out rivalUPDATE 5-EU hands down record antitrust fine to IntelAMD Delivers the World`s First 1 GHz Graphics Processor <AMD.N>REFILE-Reuters Summit-Nvidia accuses Intel of unfair pricingREUTERS SUMMIT-AMD <AMD.N> CEO SEES COMPANY TURNING NET PROFIT, FREE CASH FLOW  POSITIVE BY YEAR END IF DEMAND RETURNS TO \\""NORMAL SEASONALITY\\""  REUTERS SUMMIT-AMD CEO SAYS \\""HOPEFUL\\"" PC Q4 SALES WILL SEE A BIT OF GROWTH FROM  Q4 2008  Reuters Summit-UPDATE 1-Nvidia CEO says demand \\""growing nicely\\""Reuters Summit-UPDATE 1-AMD sees turning a profit by year's endOverclocking Trials Push AMD Phenom(TM) II Processors to the Limit <AMD.N>Reuters Summit-SEMI says Europe chip industry needs leadershipFITCH REVISES AMD'S SR UNSECURED DEBT TO 'CC/RR6'; AFFIRMS IDR AT 'B-'; OUTLOOK NEGATIVEAMD and Leading Application Providers Make Accelerated Video Experiences Possible for Millions of Consumers <AMD.N>INTEL <INTC.O> CFO SEES H2 2009 DEMAND AT LOWER LEVEL THAN H2  2008    INTEL <INTC.O> CFO SEES \\""HEALTHY\\"" FACTORY UTILISATION OF A  LITTLE UNDER 80 PERCENT IN H2    INTEL <INTC.O> CFO SAYS LIKELY TO TAKE CHARGE FOR $1.5 BILLION  EU FINE THIS QUARTER    INTERVIEW-Intel CFO sees H2 2009 demand below year earlierAMD to Host Server Platform Update Global Webcast <AMD.N>UPDATE 1-Abu Dhabi bids for control of Chartered Semi-reportUPDATE 2-Chartered Semi denies Abu Dhabi takeover bidAMD <AMD.N> SAYS DECISION ELIMINATES ONE OF THE PLAINTIFF'S ARGUMENTS IN THE BROADER ACTION"
2009,6,"AMD Triples the Performance of ATI Embedded Graphics Chips <AMD.N>RPT-Slowdown, shortages in key components in focus at ComputexNew Six-Core AMD Opteron Processor Delivers Up to Thirty-Four Percent More Performance-per-Watt in Exact Same Platform <AMD.N> BOXX Introduces New Workstations Featuring Six-Core AMD Opteron(TM) ProcessorsSupermicro Optimizes Full Line of AMD-based Server, Blade, and Workstations for New... <SMCI.O><AMD.N>AMD Introduces Next Generation AMD Athlon II Processor, Adds Dual Core to Record-Setting AMD Phenom II Processor Lineup <AMD.N>AMD, Intel play computer server tennisAMD Demonstrates World`s First Microsoft DirectX 11 Graphics Processor <AMD.N>Phoenix Technologies Announces HyperSpace(TM) as the Only Instant-On Computing Environment... <AMD.N><PTEC.O>AMD Welcomes GLOBALFOUNDRIES` Commitment to Build Industry-Leading Semiconductor Manufacturing Facility in Upstate New York <AMD.N>Intel relinquishes Q1 market share to AMD -iSuppliUPDATE 1-Merkel says must consider aiding German chipmakersAMD ATI Stream Technology Accelerates Adobe Premiere Pro CS4 Workflows <AMD.N>NORTH AMERICAN SEMICONDUCTOR EQUIPMENT INDUSTRY POSTS MAY 2009 BOOK-TO-BILL RATIO OF 0.74 - SEMISupermicro Showcases World's Densest and Greenest HPC Solutions at ISC '09 <AMD.N><SMCI.O>The `Best-of-the-Best` Supercomputers Leverage AMD Opteron Processors <AMD.N>GLOBALFOUNDRIES ANNOUNCES NEW FAB 2 EXECUTIVE LEADERSHIP TEAMAMD Continues to Drive Industry Adoption of GPU Acceleration in Enterprise and HPC Environments <AMD.N>"
2009,7,"GLOBALFOUNDRIES APPOINTS HEAD OF ENTERPRISE QUALITY, COMPLETES SENIOR LEADERSHIP TEAMAMD Delivers High Energy Efficiency and the Processing Power of Six-Cores in a Consistent Power Envelope <AMD.N>US STOCKS-Futures up on Intel results, regional factory dataUS STOCKS-Wall St rises on Intel boost as factory data helpsUS STOCKS-Wall St jumps on Intel results and NY factory dataUS STOCKS-Wall St jumps on Intel results, dataUS STOCKS-Wall St surges on Intel results, dataUS STOCKS-Intel results, data fuel broad rally on Wall StREFILE-US STOCKS-Intel results, data fuel broad rally on Wall StAMD <AMD.N> Q2 SHR LOSS $0.49AMD <AMD.N> Q2 REVENUE $1.18 BLNAMD Reports Second Quarter Results <AMD.N> - Part 1AMD Reports Second Quarter Results <AMD.N> - Part 2AMD Reports Second Quarter Results <AMD.N> - Part 3AMD <AMD.N> SAYS Q2 GROSS MARGIN WAS DISAPPOINTINGBRIEF-AMD reports Q2 resultsADVANCED MICRO DEVICES <AMD.N> SHARES FALL 9.8 PCT AFTER THE  BELL AS IT REPORTS RESULTS    AMD <AMD.N> Q2 GROSS MARGIN WAS 37 PCTUPDATE 1-AMD posts wider than expected loss, shrs tankUPDATE 2-AMD'S 2nd quarter fizzles, shares tankAMD Ready with Unified, WHQL-Certified Graphics Drivers for Windows 7 RTM <AMD.N>AMD Set to Enable Ultimate Visual Experience for Consumer PCs with Windows 7 <AMD.N>AMD Joins GLOBALFOUNDRIES to Break Ground on Industry-Leading Semiconductor Manufacturing Facility in Upstate New York <AMD.N>ATI FirePro S400 Synchronization Module Creates Smooth Virtual Canvas For Pro Video and Broadcast Professionals Rendering and Synchronizing Critical Video and 3D Applications <AMD.N>AMD Delivers Its Most Powerful Professional 3D Graphics Card With Up To Four Times The Processing Power And More Memory Bandwidth Than Comparable Competing Solution1 <AMD.N>INTEL CORP <INTC.O> SALES AND MARKETING CHIEF SAYS NETBOOKS 'WELL ESTABLISHED' IN MARKETSINTEL CORP <INTC.O> SALES AND MARKETING CHIEF SAYS BUSINESS TECH SPENDING HAS NOT RECOVEREDINTEL CORP <INTC.O> SALES AND MARKETING CHIEF SAYS DOESN'T EXPECT FIRST-TIME COMPUTER BUYERS TO PURCHASE NETBOOKSBRIEF-Intel says does not see first-time computer buyers going for netbooks"
2009,8,"GLOBAL SEMICONDUCTOR SALES RISE 17 PERCENT QUARTER-ON-QUARTER - SIAATI FirePro M7740 Graphics Accelerator and Dell Precision M6400 Together Redefine Mobile Workstation Performance and Scalability <AMD.N>AMD Announces Planned Support for OpenGL 3.1; OpenGL 3.2 Support Expected to Follow <AMD.N>UPDATE 2-Nvidia results top expectations, shares riseAMD Adds New Levels of Processing Performance to Embedded BGA Client Platform <AMD.N>AMD Takes Notebook Discrete Graphics Market Share Lead1 <AMD.N>Newport Digital Technologies, Inc., Announces Appointment of Weiling Tsao, Advanced... <MNBZ.OB><AMD.N>NORTH AMERICA-BASED MANUFACTURERS OF SEMICONDUCTOR EQUIPMENT POSTED $569.7 MILLION IN ORDERS IN JULY 2009 - SEMIADVANCED MICRO DEVICES <AMD.N> SHARES UP 5.1 PCT TO $3.89 IN  PREMARKET TRADING AFTER CITIGROUP UPGRADES TO \\""BUY\\""  BEFORE THE BELL-Advanced Micro shares rise after upgradeUS RESEARCH SUMMARY-S&P 500 Aug 24 1535 GMTAMD Publishes Ninth Annual Global Climate Protection Plan and 2008 Corporate Responsibility Report <AMD.N>AMD`s World Renowned ATI Radeon HD 4800 Series Found In High Performance iMac and Mac Pro Computers Complements Snow Leopard With OpenCL <AMD.N>More Choices Available for Cloud and Dense Computing Environments with New Six-Core AMD Opteron EE Processor <AMD.N>SIA SAYS WORLDWIDE SALES OF SEMICONDUCTORS IN JULY WERE $18.2 BLN, UP 5.3 PERCENT FROM JUNEBRIEF-Global chip sales increase 5.3 percent from June-SIAUPDATE 1-Global chip sales rise 5.3 pct in July vs June - SIA"
2009,9,"Toshiba eyes outsourcing chips to Chartered -NikkeiUPDATE 1-Toshiba may outsource some top-line chip productionMoody's places Chartered Ba2 rating on review for possible cutMoody's says may cut Chartered Semi's ratingAMD Strengthens Global Partnership with Clevo to Distribute Notebooks Powered by AMD Platform Technology to Emerging Mobile Markets <AMD.N>Consumers Gain Clarity in the PC Buying Experience with VISION Technology from AMD <AMD.N>AMD Demonstrates the PC`s Next Act at Experience Events Worldwide <AMD.N>Industry`s First Sub-$100 Quad-Core CPU1 Powers New AMD Mainstream Desktop Platforms: Multimedia Entertainment is More Affordable than Ever <AMD.N>NORTH AMERICA-BASED MANUFACTURERS OF SEMICONDUCTOR EQUIPMENT POSTED $599.0 MILLION IN ORDERS IN AUGUST - SEMIBRIEF-North American semiconductor equipment industry posts Aug book-to-Bill Ratio of 1.03 - SEMIAMD Advances Its Commitment to OpenCL for GPU with Review by Standards Body <AMD.N>New AMD Server Platform Promotes Performance and Power Efficiency <AMD.N>EU: DELL SAID ANY MOVE TO SWITCH TO AMD SUPPLIES COULD HAVE DRAWN \\""SEVERE\\"" RETALIATION FROM INTELSupermicro Launches Six-Core Opteron With PCI-E 2.0 Solutions <AMD.N><SMCI.O>FACTBOX: European regulators vs IntelAMD Changes the Game with ATI Radeon HD 5800 Series DirectX� 11-Compliant Graphics Cards, Harnessing the Most Powerful Processor Ever Created1 <AMD.N>CORRECTING and REPLACING AMD Changes the Game with ATI Radeon HD 5800 Series DirectX� 11-Compliant Graphics Cards, Harnessing the Most Powerful Processor Ever Created1 <AMD.N>AMD Fusion Partner Program Designed to Help Drive Global AMD Channel Growth and Partner Success <AMD.N>AMD Announces Open Physics Initiative Designed to Bring New Levels of Realism to Gaming, Simulations, Popular Applications <AMD.N>"
2009,10,"S&P AFFIRMS AMD 'CCC+' CCR; OUTLOOK REVISED TO POSITIVETEXT-S&P changes Adv Micro Devices outlk to positivePREVIEW-Strong Intel Q3 expected, outlook crucialUPDATE 4-US Justice Dept opens IBM antitrust probeAMD NAMES THOMAS SEIFERT CHIEF FINANCIAL OFFICERAMD Names Thomas Seifert Chief Financial Officer <AMD.N>AMD and CyberLink Announce Strategic Initiative to Accelerate Popular Consumer Video Applications with Windows 7 DirectX 11 DirectCompute <AMD.N>ANALYSIS-Some fear overly aggressive FTC after new bloodBRIEF-RESEARCH ALERT-UBS raises AMD, cuts SanDiskADVANCED MICRO DEVICES <AMD.N> SHARES UP 5.6 PCT AFTER THE BELL AFTER INTEL  RESULTS          UPDATE 2-Intel quarterly results beat Street, shares riseAMD <AMD.N> SAYS EXPECTS ITS PRODUCT COMPANY REVENUE TO BE UP MODESTLY FOR THE FOURTH QUARTER OF 2009AMD <AMD.N> SAYS EXPECTS ITS PRODUCT COMPANY REVENUE TO BE UP MODESTLY FOR THE FOURTH QUARTER OF 2009.AMD Reports Third Quarter Results <AMD.N> - Part 2AMD Reports Third Quarter Results <AMD.N> - Part 1AMD Reports Third Quarter Results <AMD.N> - Part 3AMD Reports Third Quarter Results <AMD.N> - Part 4AMD <AMD.N> SAYS THIRD QUARTER 2009 AMD GROSS MARGIN WAS 42 PERCENTADVANCED MICRO DEVICES <AMD.N> SHARES RISE 3.4 PCT TO $6.40 IN EXTENDED TRADE  AFTER Q3 RESULTS  AFTER THE BELL-Advanced Micro climbs after resultsUPDATE 1-Chipmaker AMD loss beats Street, shares upREFILE-UPDATE 1-Chipmaker AMD loss beats Street, shares upADVANCED MICRO DEVICES <AMD.N> SHARES REVERSE COURSE; DOWN 2.3 PCT TO $6.10  AFTER Q3 RESULTS  AFTER THE BELL-AMD shares reverse, now downADVANCED MICRO DEVICES INC <AMD.N> EXEC SAYS Q4 OPERATING EXPENSES APPROXIMATELY IN LINE WITH THE BREAKEVEN MODELUPDATE 2-AMD loss beats Street, but shares slideADVANCED MICRO DEVICES INC <AMD.N> EXEC SAYS CORPORATE IT \\""WALLETS STARTING TO FREE UP\\""ADVANCED MICRO DEVICES INC <AMD.N> EXEC SAYS GUIDING LESS BULLISH THAN SEASONALITY IN Q4 BECAUSE ECONOMY HAS A WAYS TO GO TO GET BACK ON ITS FEETBRIEF-Advanced Micro Devices exec says Q4 revenue up \\""modestly\\""WRAPUP 1-Google, IBM round out strong tech results weekUPDATE 3-AMD loss beats Street, but shares slideUPDATE 4-AMD loss beats Street, but shares slideBRIEF-U.S. prosecutors, FBI announce charges in fund insider trading caseUPDATE 2-U.S. charges 6 with hedge fund insider tradingUPDATE 6-US charges billionaire Rajaratnam with insider tradingAMD Expands Award-Winning Line of Graphics Products with Introduction of ATI Radeon HD 5700 Series, Delivers Best-in-Class1 Windows 7 Performance, DirectX 11 Gaming and ATI Eyefinity Multi-Monitor Technology <AMD.N>WRAPUP 1-U.S. poised to bring more insider trading casesUPDATE 1-IBM veteran exec put on leave after insider arrestCORRECTED-WRAPUP 1-U.S. poised to bring more insider trading casesWRAPUP 2-U.S. poised to bring more insider trading casesAMD Athlon II Processors Pair with AMD Desktop Platforms to Deliver Enhanced Value for Multi-Core and Low-Power PCs <AMD.N>ANALYSIS-Cozy Valley culture under scrutiny in Galleon caseVISION Technology from AMD Helps Speed and Simplify Next-Generation Computing with Windows 7 <AMD.N>AMD Opteron Processor-Based Platform Helps ATCA Servers Deliver Improved Network Traffic <AMD.N>UPDATE 1-Intel CEO sees higher corporate PC spend in 2010ADVANCED MICRO DEVICES <AMD.N> AFFILIATE GLOBALFOUNDRIES SAYS HAS NOT BEEN CONTACTED BY JUSTICE DEPT OR ANY OTHER GOVERNMENT AGENCY IN GALLEON INVESTIGATIONEx-AMD CEO linked to Galleon via info leak-WSJAMD <AMD.N> SAYS THOROUGHLY REVIEWING THE SITUATION FOLLOWING REPORT LINKING EX-CEO RUIZ TO GALLEON INSIDER TRADING CASEAMD SAYS UNAWARE OF ANY ALLEGATION OF CRIMINAL MISCONDUCT ON PART OF CURRENT OR FORMER AMD EMPLOYEESBRIEF-AMD says reviewing the situation after report linking ex-CEO Ruiz to Galleon insider trading case"
2009,11,"UPDATE 1-Global Q3 chip sales rise 19.7 pct sequentially - SIABRIEF-Former AMD CEO steps down as chairman UAE JV-cnbcPRESS RELEASE - RUIZ TO STEP DOWN AS GLOBALFOUNDRIES CHAIRMANGLOBALFOUNDRIES - RUIZ WILL TAKE A VOLUNTARY LEAVE OF ABSENCE EFFECTIVE IMMEDIATELYGLOBALFOUNDRIES - RUIZ WILL RESIGN FROM THE COMPANY IN JANUARYGLOBALFOUNDRIES - RUIZ WILL BE REPLACED BY ALAN ROSS, WHO WILL SERVE AS INTERIM CHAIRMAN, EFFECTIVE IMMEDIATELYBRIEF-Globalfoundries chairman to resignUPDATE 1-Ruiz to step down as Globalfoundries chaimanREFILE-UPDATE 1-Ruiz to step down as Globalfoundries chairmanUPDATE 2-Ruiz to step down as Globalfoundries chairmanMORGAN STANLEY CUTS XILINX INC <XLNX.O> PRICE TARGET TO $24 FROM $30US RESEARCH SUMMARY-S&P 500 Nov 3 1210 GMTUS RESEARCH SUMMARY-S&P 500 Nov 3 1505 GMTUS RESEARCH SUMMARY-S&P 500 Nov 3 1733 GMTUPDATE 2-Intel, chip stocks slide after M.Stanley downgrade =2SIA SAYS PROJECTING GLOBAL SEMICONDUCTOR SALES OF $219.7 BILLION FOR 2009, A DECLINE OF 11.6 PERCENTBRIEF-SIA 2009 chip sales outlookUPDATE 1-Nvidia's Q3 beats Street, shares climbCORRECTED-UPDATE 1-Nvidia's Q3 beats Street, shares climbADVANCED MICRO DEVICES INC <AMD.N> SAYS EXPECTS CAPITAL EXPENDITURE TO BE ABOUT $100 MILLION FOR 2009ADVANCED MICRO DEVICES INC <AMD.N> SAYS WANTS TO KEEP LIQUIDITY OF $1 BILLION CASHADVANCED MICRO DEVICES INC <AMD.N> SAYS EXPECTS GROSS MARGINS OF 40 TO 45 PERCENT FOR 2010ADVANCED MICRO DEVICES INC <AMD.N> SAYS EXPECTS TO REMAIN PROFITABLE IN 2010, AND HAVE POSITIVE FREE CASH FLOWADVANCED MICRO DEVICES INC <AMD.N> SAYS EXPECTS 2010 CAPITAL EXPENDITURE TO BE AROUND $120  MILLIONADVANCED MICRO DEVICES INC <AMD.N> SAYS EXPECTS 10-15 PERCENT MARKET GROWTH FOR GRAPHICS CHIPSADVANCED MICRO DEVICES INC <AMD.N> SAYS EXPECTS 10-15 PERCENT MARKET GROWTH FOR MICROPROCESSORSADVANCED MICRO DEVICES INC <AMD.N> SAYS TARGETING GROSS MARGIN OF ABOVE 45 PERCENT IN \\""LONGER TERM MODEL\\""ADVANCED MICRO DEVICES INC <AMD.N> SAYS MAINTAINING Q4 EARNINGS GUIDANCEAMD BUILDS ON PRODUCT MOMENTUM WITH STRONG PLATFORM AND TECHNOLOGY ROADMAP DISCLOSURES AT ANNUAL FINANCIAL ANALYST DAYBRIEF-Advanced Micro Devices says maintaining Q4 earnings guidanceFund manager in Galleon probe names Marvell workerUPDATE 1-AMD expects key business to turn profit in 2010UPDATE 2-AMD expects key business to be profitable in 2010AMD <AMD.N> SAYS INTEL WILL PAY AMD $1.25 BILLIONAMD and Intel Announce Settlement of All Antitrust and IP Disputes <AMD.N>AMD <AMD.N> SAYS WILL DROP PENDING LITIGATION INCLUDING CASE IN U.S. DISTRICT COURT IN DELAWARE AND TWO CASES PENDING IN JAPANAMD <AMD.N> SAYS IT AND INTEL OBTAIN PATENT RIGHTS FROM A NEW 5-YEAR CROSS LICENSE AGREEMENTAMD <AMD.N> SAYS WILL ALSO WITHDRAW ALL OF ITS REGULATORY COMPLAINTS WORLDWIDEBEFORE THE BELL-Advanced Micro rises after source commentSTOCKS NEWS US-Intel, AMD announcing settlement: sourcesUPDATE 1-Intel to pay AMD $1.25 bln, settle all disputesAMD <AMD.N> SHARES UP 24.1 PCT AT $6.60  ADVANCED MICRO DEVICES INC <AMD.N> SAYS SEEKS 'CONTINUED VIGILANCE' FROM COMPETITION AGENCIES AROUND WORLDAMD <AMD.N> SAYS INTEL <INTC.O> DEAL MARKS MOVE FROM \\""WAR TO PEACE\\""Intel-AMD settlement won't change NY suit-sourcePICKSTHATMOVE.COM ANNOUNCES INVESTMENT OPINION ON ADVANCED MICRO DEVICES, WAL-MART STORES INC., PINETREE CAPITAL INC., 3COM CORP. AND HOLLOMAN ENERGY CORP.INTEL <INTC.O> SAYS WILL FILE PROPOSED SETTLEMENT WITH FTC TODAY, MAKING IT PUBLICINTEL <INTC.O> SAYS NEGOTIATIONS WITH AMD BEGAN IN APRIL ON SETTLEMENTINTEL <INTC.O> SAYS ISSUES REMAIN WITH EUROPEAN COMMISSION, DISCUSSIONS TO CONTINUEUPDATE 2-Intel to pay AMD $1.25 bln, settle all disputesCORRECTED-UPDATE 2-Intel to pay AMD $1.25 bln, settle all disputesS&PBULLETIN: INTEL'S RTG UNAFFECTED BY AMD LITIGATION SETTLEMTRPT-INTEL SAYS NOT WAVERED IN CONVICTION THAT IT OPERATED WITHIN THE BALANCE OF THE LAWCORRECTED-INTEL SAYS WILL MEET WITH SEC (NOT FTC) TO EXPLAIN AMD SETTLEMENTRPT-INTEL <INTC.O> SAYS WILL FILE PROPOSED SETTLEMENT WITH FTC TODAY, MAKING IT PUBLICCORRECTED-INTEL SAYS WILL MEET WITH FTC (NOT SEC) TO EXPLAIN AMD SETTLEMENTBRIEF-Intel says not wavered in conviction that it operated within the balance of the lawUS STOCKS-Wall Street falls on strong dollar, consumer fearsCritical Alerts for AMD, Target, Goldcorp, Coach, and Darden Restaurants Released by Seven Summits ResearchMost Powerful Supercomputer in the World Powered by the Six-Core AMD Opteron Processor <AMD.N>MOODY'S RAISES AMD'S CFR TO B2, NOTES TO B3; OUTLOOK POSITIVERPT-MOODY'S RAISES ADVANCED MICRO DEVICES INC <AMD.N> CFR TO B2, NOTES TO B3; OUTLOOK POSITIVEBRIEF-Moody's raises AMD to CFR B2, notes to B3, otlk pos Cray Announces Newest Upgrades to Industry-Leading Cray XT Supercomputer SeriesAMD Accelerates Flash Player 10.1 with ATI Stream Technology <AMD.N>Windows Server 2008 R2 and Windows 7 Benefit from AMD Virtualization Technology and Energy Efficiency <AMD.N>New ATI Stream Development Platforms Now Available from Colfax and Exxact <AMD.N>AMD Appoints Nicholas Donofrio to Company`s Board of Directors <AMD.N>AMD Introduces ATI Radeon HD 5970: Fastest Graphics Card in the World1 <AMD.N>EU OMBUDSMAN SAYS EU COMMISSION MADE PROCEDURAL ERRORS IN ITS INVESTIGATION OF INTEL <INTC.O>OMBUDSMAN'S OPINION NOT EXPECTED TO AFFECT COMMISSION'S 1.06 BLN EURO ANTI-TRUST FINE AGAINST INTELAMD ANNOUNCES PRIVATE OFFERING OF $500 MILLION OF SENIOR NOTESAMD Announces Private Offering of $500 Million of Senior Notes <AMD.N>AMD <AMD.N> SAYS INTENDS TO USE PROCEEDS, ALONG WITH EXISTING CASH, TO PURCHASE ITS 5.75% CONVERTIBLE SENIOR NOTES DUE 2012AMD COMMENCES TENDER OFFER FOR ITS 5.75% CONVERTIBLE SENIOR NOTES DUE 2012AMD Commences Tender Offer for Its 5.75% Convertible Senior Notes Due 2012 <AMD.N>AMD Announces Redemption of 7.75% Senior Notes Due 2012 <AMD.N>AMD <AMD.N> - COMMENCED A CASH TENDER OFFER FOR UP TO $1,000,000,000 OF ITS OUTSTANDING 5.75% CONVERTIBLE SENIOR NOTES DUE 2012BRIEF-AMD commences tender offerADVANCED MICRO <AMD.N> SHARES UP 2.6 PCT TO $6.79 IN PREMARKET  TRADING; ANNOUNCES PRIVATE OFFERING, STARTS TENDER OFFER  Advanced Micro bonds extend gains-MarketAxessUPDATE 1-AMD to redeem up to $1 bln of notes, shares riseMOODY'S ASSIGNS B2 RATING TO AMD'S SENIOR UNSECURED NOTESMOODY'S RATES ADVANCED MICRO DEVICES INC <AMD.N> $500 MLN PROPOSED NOTES B2UPDATE 2-AMD to redeem up to $1.4 bln of notes, shares riseS&P AFFIRMS AMD 'B-' CCR; NEW SENIOR NOTES RATED 'B-'TEXT-S&P affirms AMD's 'B-' ratingAMD <AMD.N> SAYS COMPENSATION COMMITTEE APPROVED REVERSAL OF ANNUAL BASE SALARIES REDUCTIONS COMMENCING ON NOV 23 - SEC FILINGAMD <AMD.N> SAYS REINSTATED ANNUAL BASE SALARY OF CEO DERRICK MEYER - FROM $720,000 TO $900,000AMD ANNOUNCES PRICING OF PRIVATE OFFERING OF $500 MILLION OF SENIOR NOTESAMD Announces Pricing of Private Offering of $500 Million of Senior Notes <AMD.N>AMD <AMD.N> SAYS TO SELL AGGREGATE PRINCIPAL AMOUNT OF ITS 8.125% SENIOR NOTES DUE 2017 IN A PRIVATE OFFERINGNew Issue-AMD sells $500 mln in 8-yr notesBRIEF-AMD announces pricing of private offering of $500 mln notesTEXT-Fitch afms AMD's IDR at 'B-'; revises otlk to positiveUPDATE 1-Galleon's Rajaratnam denies inside trading chargesANALYSIS-Spain's Almunia faces tough task in EU antitrust job"
2009,12,"DiRT 2 Offers Exhilarating DirectX� 11 Gaming Experience - Only On ATI Radeon Graphics Cards1 <AMD.N>ADVANCED MICRO DEVICES INC <AMD.N> SAYS ISSUED $500 MLN AGGREGATE PRINCIPAL AMOUNT OF 8.125% SENIOR NOTES DUE 2017 ON NOV 30- 8KBRIEF-Advanced Micro Devices issued $500 mln senior notes-8kAMD to Present at Barclays Capital 2009 Global Technology Conference <AMD.N>AMD and SiSoftware Collaborate on Development of an Industry Benchmark Suite for OpenCL <AMD.N>UPDATE 1-McKinsey's Kumar, named in Galleon case, departsUS RESEARCH SUMMARY-S&P 500 Dec 7 1525 GMTUPDATE 2-AMD, Nvidia shares rise as Intel scraps graphic chipUS RESEARCH SUMMARY-S&P 500 Dec 7 2021 GMTUPDATE 3-AMD, Nvidia shares rise as Intel scraps graphic chipADVANCED MICRO DEVICES <AMD.N> CFO SAYS WILL FOCUS RESEARCH EFFORTS ON HIGHER-MARGIN PRODUCTSADVANCED MICRO DEVICES <AMD.N> CFO SAYS GOAL TO HAVE CONSISTENT PROFITABILITY GOING FORWARDADVANCED MICRO DEVICES <AMD.N> CFO SAYS DEBT AND RESTRUCTURING BALANCE SHEET AS HIGH PRIORITY AS CAN BEADVANCED MICRO DEVICES <AMD.N> CFO SAYS RULED OUT EQUITY FOR CAPITAL RAISING GOING FORWARD FOR THE SHORT TERMADVANCED MICRO DEVICES <AMD.N> CFO SAYS IS NOT DONE WITH DEBT REDUCTION ACTIONSADVANCED MICRO DEVICES <AMD.N> CFO SAYS BIGGEST ROADBLOCKS ARE GONE FOR FULLY SPINNING OFF GLOBALFOUNDRIES FROM PRODUCT COMPANYADVANCED MICRO DEVICES <AMD.N> CFO SAYS PLANS TO FINISH SPINOFF \\""SOONER RATHER THAN LATER\\""ADVANCED MICRO DEVICES <AMD.N> CFO SAYS DESKTOP MARKET COULD BE DOWN DESPITE EXPECTATIONS OF FLATUPDATE 2-Ex-IBM exec & others deny SEC charges in Galleon caseUPDATE 3-Ex-IBM exec, others deny SEC charges on GalleonUPDATE 1-AMD sees margins for 2011 above 45 percentCORRECTED-(OFFICIAL)-ADVANCED MICRO DEVICES <AMD.N> CFO SAYS GROSS MARGIN COULD BE ABOVE 45PCT FOR 2011 (NOT 2010)RPT-ADVANCED MICRO DEVICES <AMD.N> CFO SAYS WILL FOCUS RESEARCH EFFORTS ON HIGHER-MARGIN PRODUCTSRPT-ADVANCED MICRO DEVICES <AMD.N> CFO SAYS GOAL TO HAVE CONSISTENT PROFITABILITY GOING FORWARDRPT-ADVANCED MICRO DEVICES <AMD.N> CFO SAYS RULED OUT EQUITY FOR CAPITAL RAISING GOING FORWARD FOR THE SHORT TERMRPT-ADVANCED MICRO DEVICES <AMD.N> CFO SAYS TARGETING GROSS MARGIN ABOVE 40PCT FOR 2010RPT-ADVANCED MICRO DEVICES <AMD.N> CFO SAYS PLANS TO FINISH SPINOFF \\""SOONER RATHER THAN LATER\\""RPT-ADVANCED MICRO DEVICES <AMD.N> CFO SAYS SEES SECOND HALF OF 2010 STRONGER THAN FIRST HALFBRIEF-Advanced Micro Devices CFO says plans to finish spinoff \\""sooner rather than later\\""Experience Dragon Age: Origins in Dazzling Clarity with ATI Eyefinity Multi-Display Technology from AMD <AMD.N>ADVANCED MICRO DEVICES INC <AMD.N> SHARES UP 5.1 PCT IN  PREMARKET AS FTC SUES INTEL <INTC.O>  BEFORE THE BELL-ADM rallies as FTC sues IntelRPT-BEFORE THE BELL-AMD rallies as FTC sues IntelUPDATE 1-U.S. FTC sues chip giant IntelBREAKINGVIEWS-Obama tightens antitrust screws with Intel suitFTC'S FEINSTEIN SAYS CONTEMPLATED REMEDIES IN INTEL CASE INCLUDE PRICING MODIFICATIONS, LIMITATIONS ON PRODUCT BUNDLINGFTC'S FEINSTEIN - POSSIBILITY OF SETTLEMENT IN INTEL CASE WAS CONSIDERED AND DISCUSSED, PARTIES WERE NOT ABLE TO COME TO TERMSFTC'S FEINSTEIN - 'IF AS A RESULT OF ADDITIONAL DISCOVERY THERE WAS SOME REASON TO AMEND THE COMPLAINT THERE ARE PROCEDURES TO DO THAT'FTC'S FEINSTEIN - 'WE ARE LOOKING AT 18 MONTHS TO 2 YEARS' FOR INTEL CASE TO GO THROUGH TRIAL AND THROUGH FULL COMMISSIONUPDATE 3-U.S. FTC sues Intel for abusing market dominanceUPDATE 4-U.S. FTC sues Intel for abusing market dominanceUS STOCKS-Wall St rises on bets Fed will keep rates lowRPT-US STOCKS-Wall St rises on bets Fed will keep rates lowUPDATE 5-U.S. FTC sues Intel for abusing market dominanceAMD ANNOUNCES COMPLETION OF THE TENDER OFFER FOR ITS 5.75% CONVERTIBLE SENIOR NOTES DUE 2012AMD Announces Completion of the Tender Offer for Its 5.75% Convertible Senior Notes Due 2012 <AMD.N>AMD <AMD.N> SAYS PURCHASE PRICE EQUAL TO $990 PER $1,000 OF THE PRINCIPAL AMOUNTAMD <AMD.N> SAYS $1,351,634,000 AGGREGATE PRINCIPAL AMOUNT OF NOTES WERE VALIDLY TENDERED AND NOT WITHDRAWNBRIEF-AMD says completes tender offer for 5.75 pct convertible senior notes due 2012AMD Releases Production Version of Second-Generation Software Development Platform for ATI Stream Computing <AMD.N>UPDATE 4-Rajaratnam, Chiesi plead innocent in Galleon caseU.S. TRADE COURT TO INVESTIGATE RICHTEK CHARGES OF PATENT VIOLATIONS BY AMD, UPI SEMICONDUCTOR AND OTHERSBRIEF-US trade court to probe Richtek charges of patent violations by AMD, othersUPDATE 1-U.S. panel to probe Richtek patent charges"
