2013,7,"Top Tech Releases Acclaimed State of Tech Report, Updates Outlooks for Intel, Linear Technology, Advanced Micro Devices, SanDisk, and Cypress SemiconductorAMD ANNOUNCES KEYNOTE LINEUP FOR APU13: A TOUR DE FORCE OF HETEROGENEOUS COMPUTE LEADERS AMD Announces Keynote Lineup for APU13: A Tour de Force of Heterogeneous Compute Leaders <AMD.N>Early Morning Insight: Micron Technology, Advanced Micro Devices, Take-Two Interactive, and VeriSignADVANCED MICRO DEVICES INC <AMD.N> SHARES UP 6.5 PCT IN PREMARKET TRADEUS STOCKS-Futures jump in wake of Bernanke commentsBRIEF-Advanced Micro Devices shares up 6.5 percent in premarket tradeMARKET PULSE-Bridgepoint Education, Alnylam Pharma, gold minersMARKET PULSE-Bridgepoint, Microsoft, Leading Brands, gold minersUS STOCKS-Wall St climbs on Bernanke, S&P 500 passes recordUS STOCKS-Bernanke's reassurance propels shares to record highsNew Industry innovations, Top Rankings, Events, Partnerships, and New Products - Research Report on Xilinx, Check Point, AMD, InvenSense and Fairchild SemiconductorFitch Updates Recovery Analyses for U.S. Technology Sector <AMD.N><FDC.N>FITCH UPDATES RECOVERY ANALYSES FOR U.S. TECHNOLOGY SECTORAMD REPORTS 2013 SECOND QUARTER RESULTSAMD <AMD.N> Q2 REVENUE $1.16 BLN VS I/B/E/S VIEW $1.11 BLN AMD Reports 2013 Second Quarter Results <AMD.N>AMD <AMD.N> SEES Q3 2013 REVENUE UP ABOUT 22 PCTAMD <AMD.N> Q2 SHR LOSS $0.10AMD <AMD.N> Q2 SHR VIEW $-0.12 -- THOMSON REUTERS I/B/E/SAMD <AMD.N> Q2 NON-GAAP SHR LOSS $0.09AMD <AMD.N> QTRLY GROSS MARGIN 40 PERCENTAMD <AMD.N> SAYS EXPECT SIGNIFICANT REVENUE GROWTH AND A RETURN TO PROFITABILITY IN THE THIRD QUARTERAMD <AMD.N> Q3 SHR VIEW $-0.02, REV VIEW $1.22 BLN -- THOMSON REUTERS I/B/E/SADVANCED MICRO DEVICES INC <AMD.N> SHARES UP 3 PCT AFTER THE BELL FOLLOWING RESULTSBRIEF-AMD shares up 3 pct after the bellBRIEF-AMD Q2 non-GAAP loss per share $0.09Chipmaker AMD's second-quarter revenue beats expectationsCORRECTED-AMD <AMD.N> SEES Q3 2013 REVENUE UP 22 PCT,  PLUS OR MINUS 3 PERCENT, SEQUENTIALLY (ADDS DROPPED WORDS \\"" PLUS OR MINUS 3 PERCENT, SEQUENTIALLY\\"")RPT-AMD <AMD.N> Q2 SHR LOSS $0.10; Q2 NON-GAAP SHR LOSS $0.09; Q2 REVENUE $1.16 BLNRPT-AMD <AMD.N> QTRLY GROSS MARGIN 40 PERCENTRPT-AMD <AMD.N> SAYS EXPECT SIGNIFICANT REVENUE GROWTH AND A RETURN TO PROFITABILITY IN THE THIRD QUARTERRPT-AMD <AMD.N> Q3 SHR VIEW $-0.02, REV VIEW $1.22 BLN -- THOMSON REUTERS I/B/E/SAMD <AMD.N> Q2 SHR VIEW $-0.12, REV VIEW $1.11 BLN -- THOMSON REUTERS I/B/E/SADVANCED MICRO DEVICES INC <AMD.N> SHARES CHANGE DIRECTION, SLIDE 4.5 PCT AFTER RESULTSBRIEF-AMD shares off 4.5 pct after resultsBRIEF-AMD Q2 shr loss $0.10UPDATE 1-Chipmaker AMD gives 3rd-qtr revenue forecast above StreetUPDATE 2-AMD gives upbeat revenue forecast, eyes game consolesADVANCED MICRO DEVICES INC <AMD.N> SHARES DOWN 10.3 PERCENT IN PREMARKET TRADINGBRIEF-Advanced Micro Devices down 10.3 pct premarket AMD Powers Visual Computing Experiences With Industry Leaders at SIGGRAPH 2013 <AMD.N> AMD to Discuss Corporate Responsibility Program and Activities <AMD.N>Semiconductor Companies Provide Updates on Appointments, Earnings Results, and Conference Calls - Research Report on Micron, AMD, Analog Devices, NXP Semiconductors, and Fairchild SemiconductorBRIEF-Worldwide semiconductor revenue will grow 6.9% in 2013-IDC AMD Extends Embedded SoC Leadership by Lowering G-Series Energy Consumption <AMD.N>"
2013,8," AMD to Present at Citi Global Technology Conference <AMD.N>Technical Study: Micron Technology Inc., Advanced Micro Devices Inc., Take-Two Interactive Software Inc., and VeriSign Inc. <AMD.N><MU.O><VRSN.O> AMD's Groundbreaking \\""Never Settle Forever\\"" Program Empowers Gamers to Choose <AMD.N> AMD Expands Embedded Computing Offerings With New Multi-Core R-Series CPUs and Discrete AMD Radeon GPU Bundle <AMD.N> AMD Announces Proposed Sale and Lease-back of AMD Singapore Facility to Sabana Shari'ah Compliant Industrial Real Estate Investment Trust <AMD.N>AMD ANNOUNCES PROPOSED SALE AND LEASE-BACK OF AMD SINGAPORE FACILITY TO SABANA SHARI'AH COMPLIANT INDUSTRIAL REAL ESTATE INVESTMENT TRUSTAMD <AMD.N> - TRANSACTION IS EXPECTED TO GENERATE PROCEEDS OF APPROXIMATELY 59 MILLION SINGAPORE DOLLARS , $46 MILLIONAMD <AMD.N> SAYS AMD EXPECTS TO RECORD A GAIN OF APPROXIMATELY $16 MILLION IN THE THIRD QUARTER OF 2013AMD <AMD.N> SAYS AMD SINGAPORE WILL CONTINUE ITS OPERATIONS IN A PORTION OF THE SINGAPORE FACILITYAMD <AMD.N> SAYS PRIOR TO TRANSACTION CLOSE, AMD SINGAPORE NEEDS TO SECURE FINAL APPROVAL FROM THE JTC CORPORATIONBRIEF-AMD reports proposed sale and lease back of its Singapore facility to Sabana REIT AMD and Mixamo Revolutionize Character Art With World's First Real-Time Facial Capture Technology for the Unity Development Platform <AMD.N>"
2013,9," AMD Recognized for Excellence in Public Relations <AMD.N>Recognitions, Financial Guidance, Investments, and Product Enhancement - Research Report on AMD, Microchip, SolarWinds, SunEdison, and Vishay AMD Details Embedded Product Roadmap <AMD.N> AMD FirePro Professional Graphics Power New Thin and Light Mobile Workstations for Creative and Design Productivity on the Go <AMD.N> AMD Expands Elite Mobility APU Line-Up With New Quad-Core Processor <AMD.N> AMD-Adobe Collaboration Unlocks Outstanding Creative Workflows, Enhances Quality and Speed for Video Pros Everywhere <AMD.N>ADVANCED MICRO DEVICES <AMD.N> SHARES DOWN 2.6 PCT PREMARKET, TO BE MOVED FROM S&P 500 TO S&P 400 INDEXBRIEF-AMD shares down 2.6 pct premarket, to be removed from S&P 500MARKET PULSE-Oclaro, Netsol, Men's Wearhouse, Pandora Media, Weatherford AMD Collaborates With Industry Leaders to Bring the Power of 4K to Video Production at IBC 2013 <AMD.N> AMD to Webcast GPU '14 Product Showcase <AMD.N>Future Visions, Secondary Offer Pricings, Business Outlooks, Expanded Facilities and Collaborations by Semiconductor Companies-Research Report on Intel, NXP, TI, ON Semiconductor, and AMD AMD Recognized by Dow Jones Sustainability Index North America for Corporate Responsibility Commitment <AMD.N>Early Morning Insight: Micron Technology Inc., Advanced Micro Devices Inc., Take-Two Interactive Software Inc., and VeriSign Inc. AMD Helps Power Performance of All-Star Cast in Upcoming Hollywood Thriller <AMD.N> AMD to Report Fiscal Third Quarter Results on October 17, 2013 <AMD.N> AMD Radeon R9 and R7 Series Graphics Cards Usher in a New Era of Gaming Realism <AMD.N>Raptr and AMD Partner to Create AMD Gaming Evolved App, the Ultimate App for the PC Gamer <AMD.N> AMD Completes Sale and Lease-Back of AMD Singapore Facility to Sabana Shari'ah Compliant Industrial Real Estate Investment Trust <AMD.N>ADVISORY-Please ignore alert on Nvidia"
2013,10," AMD Selects SAPPHIRE as Exclusive Global Distribution Partner for AMD FirePro(TM) Professional Graphics <AMD.N> Verizon Selects AMD's SeaMicro SM15000 for Enterprise Class Services: Verizon Cloud Compute and Verizon Cloud Storage <AMD.N> AMD Releases R7 Series Graphics Cards With AMD Radeon R7 240, AMD Radeon R7 250 and AMD Radeon R7 260X GPUs <AMD.N> AMD Unleashes R9 Series Graphics Cards With AMD Radeon R9 270X and AMD Radeon R9 280X <AMD.N> AMD Announces Two New Keynote Speakers and New Influencer Insights Program for \\""APU13\\"" <AMD.N>Xx STOCKS NEWS US-Advanced Micro options imply move less than realized INTEL CORP <INTC.O> Q3 DATA CENTER GROUP REVENUE OF $2.9 BILLION, UP 6.2 PERCENT SEQUENTIALLYBRIEF-Intel third-quarter revenue $13.5 billionAMD REPORTS 2013 THIRD QUARTER RESULTSAMD <AMD.N> Q3 SHR $0.06AMD <AMD.N> Q3 SHR VIEW $0.02 -- THOMSON REUTERS I/B/E/SAMD <AMD.N> SEES Q4 2013 REVENUE UP ABOUT 5 PCTAMD <AMD.N> Q3 REVENUE $1.46 BLN VS I/B/E/S VIEW $1.42 BLNAMD <AMD.N> Q3 NON-GAAP SHR $0.04 AMD Reports 2013 Third Quarter Results <AMD.N>AMD <AMD.N> QTRLY GROSS MARGIN 36 PERCENTADVANCED MICRO DEVICES INC <AMD.N> SHARES UP 2.4 PCT IN EXTENDED TRADING AFTER RESULTSADVANCED MICRO DEVICES INC <AMD.N> SHARES TURN LOWER, FALL 2.7 PCT IN VOLATILE AFTER-HOURS TRADINGBRIEF-AMD shares turn lower after resultsxx-Advanced Micro swings to profitRPT--Advanced Micro swings to profitCORRECTED-AMD <AMD.N> SEES Q4 REVENUE UP ABOUT 5 PCT, PLUS OR MINUS 3 PERCENT, SEQUENTIALLY (ADDS DROPPED WORDS \\""PLUS OR MINUS 3 PERCENT, SEQUENTIALLY\\"")RPT-AMD <AMD.N> Q3 SHR $0.06 ; Q3 NON-GAAP SHR $0.04 ; Q3 REVENUE $1.46 BLNRPT-AMD <AMD.N> QTRLY GROSS MARGIN 36 PERCENTBRIEF- AMD Q3 revenue $1.46 blnxx UPDATE 1-Advanced Micro's third-quarter results beat expectationsAMD <AMD.N> SEES Q4 2013 NON-GAAP GROSS MARGIN TO BE APPROXIMATELY 35% - SEC FILINGREFILE-UPDATE 1-Advanced Micro's third-quarter results beat expectationsBRIEF-AMD <AMD.N> expects Q4 non-GAAP gross margin to be about 35 pct - SEC filingUPDATE 2-AMD quarterly results beat expectations but stock dropsADVANCED MICRO DEVICES INC <AMD.N> CEO SAYS EXPECTS PC INDUSTRY UNIT SHIPMENTS TO DECINE 10 PCT THIS YEAR AND SIMILAR AMOUNT IN 2014BRIEF-Advanced Micro Devices CEO expects PC industry shipments to fall 10 percent annuallyADVANCED MICRO DEVICES INC <AMD.N> SHARES DOWN 7.1 PCT IN PREMARKET TRADE AFTER BOFA MERRILL CUTS RATINGS ON THE COMPANYBRIEF-Advanced Micro Devices shares down after BofA Merrill cuts ratings AMD Radeon R9 290X Graphics Card Pioneers a New Era in Gaming Experience <AMD.N> AMD to Webcast \\""APU13\\"" Keynotes <AMD.N>"
2013,11,"AMD's Revolutionary Mantle Graphics API Adopted by Industry Leading Game Developers Cloud Imperium, Eidos-Montreal and Oxide <AMD.N>AMD's SeaMicro SM15000 Is the First Server to Provide Bare Metal Provisioning to Scale Massive OpenStack Compute Deployments <AMD.N>AMD Radeon(TM) R9 290 Graphics Card Delivers Stunning UltraHD Performance for Just $399 <AMD.N>AMD to Present at Upcoming Financial Conferences <AMD.N>AMD Announces New Unified SDK, Tools and Accelerated Libraries, for Heterogeneous Computing Developers <AMD.N>AMD Enables Server APU Software to Reimagine the Server <AMD.N>AMD ANNOUNCES CLOSING OF $500 MILLION SECURED REVOLVING LINE OF CREDITAMD Announces Closing of $500 Million Secured Revolving Line of Credit <AMD.N>BRIEF-AMD closes $500 mln secured revolving line of creditAMD Radeon R9 270 Graphics Card Packs a 1080p Gaming Punch <AMD.N>AMD 2014 Mobile APUs to Deliver Leaps in Performance and Battery Life in Tablets, 2-in-1s and Notebooks <AMD.N>Designed for Big Data Applications, AMD Announces Industry's First \\""Supercomputing\\"" Server Graphics Card With 12GB Memory <AMD.N>U.S. Government Awards AMD Contract to Research Interconnect Architectures for High-Performance Computing <AMD.N> U.S. Government Awards AMD Contract to Research Interconnect Architectures for High-Performance Computing <AMD.N>Product Updates, Investor Conferences, New Contracts, Quarterly Financial Results, and Cash Dividends - Research Report on Intel, Maxim Integrated, AMD, Spreadtrum, and AFOP"
2013,12,"SEMICONDUCTOR INDUSTRY ASSOCIATION-WORLDWIDE SALES OF SEMICONDUCTORS REACHED $27.06 BILLION FOR OCT 2013, A 7.2 PERCENT INCREASEBROADCOM CORP <BRCM.O>: OPPENHEIMER CUTS TO PERFORM FROM OUTPERFORM - THEFLYONTHEWALL.COM AMD Radeon R7 260 GPU Brings Graphics Performance, Efficiency and Value <AMD.N>AMD Radeon R7 260 GPU Brings Graphics Performance, Efficiency and Value <AMD.N> AMD to Report Fiscal Fourth Quarter and Full Year Results on January 21, 2014 <AMD.N>AMD to Report Fiscal Fourth Quarter and Full Year Results on January 21, 2014 <AMD.N> New AMD FirePro Professional Graphics Deliver Unprecedented Levels of Performance for New Mac Pro <AMD.N>New AMD FirePro Professional Graphics Deliver Unprecedented Levels of Performance for New Mac Pro <AMD.N>AMD to Host News Conference at 2014 International CES <AMD.N> AMD to Host News Conference at 2014 International CES <AMD.N>"
2014,1,"INTERVIEW-Abu Dhabi's ATIC to invest up to $10 bln in U.S. chip plant AMD Surrounds 2014 International CES Visitors With Breakthrough Visual and Audio Experiences <AMD.N>AMD and BlueStacks Collaboration Brings Full Android OS Experience to Windows PCs <AMD.N> AMD and BlueStacks Collaboration Brings Full Android OS Experience to Windows PCs <AMD.N>AMD Surrounds 2014 International CES Visitors With Breakthrough Visual and Audio Experiences <AMD.N>Investor Alert: Advanced Micro Devices, Inc. Investigation Announced by Holzer & Holzer, LLC <AMD.N>AMD Revolutionizes Compute and UltraHD Entertainment With 2014 AMD A-Series Accelerated Processors <AMD.N> AMD Revolutionizes Compute and UltraHD Entertainment With 2014 AMD A-Series Accelerated Processors <AMD.N>Robbins Geller Rudman & Dowd LLP Files Class Action Suit against Advanced Micro Devices, Inc. <AMD.N>UPDATE 3-Intel to reduce global workforce by 5 percent in 2014AMD <AMD.N> Q4 REVENUE $1.59 BLN VS I/B/E/S VIEW $1.54 BLNAMD <AMD.N> SEES Q1 2014 REVENUE DOWN ABOUT 16 PCTAMD <AMD.N> Q4 SHR VIEW $0.06 -- THOMSON REUTERS I/B/E/SAMD REPORTS 2013 FOURTH QUARTER AND ANNUAL RESULTSAMD <AMD.N> Q4 NON-GAAP SHR $0.06 AMD Reports 2013 Fourth Quarter and Annual Results <AMD.N>AMD <AMD.N> Q4 SHR $0.12AMD <AMD.N> QTRLY GROSS MARGIN OF 35 PERCENTAMD Reports 2013 Fourth Quarter and Annual Results <AMD.N> - Part 1AMD Reports 2013 Fourth Quarter and Annual Results <AMD.N> - Part 3AMD Reports 2013 Fourth Quarter and Annual Results <AMD.N> - Part 2AMD <AMD.N> Q1 REV VIEW $1.36 BLN -- THOMSON REUTERS I/B/E/SAMD <AMD.N> - FOR Q1, AMD EXPECTS REVENUE TO DECREASE 16 PERCENT, PLUS OR MINUS 3 PERCENT, SEQUENTIALLYBRIEF-AMD Q4 non-GAAP earnings per share $0.06Advanced Micro reports quarterly profit ADVANCED MICRO DEVICES INC <AMD.N> SHARES DOWN 9.6 PCT IN EXTENDED TRADING AFTER RESULTSUPDATE 1-Chipmaker AMD forecasts revenue below estimatesAMD <AMD.N> SEES COMPUTING SOLUTIONS SEGMENT REVENUE DOWN IN LINE WITH SEASONALITY- CFO, CONF CALLAMD <AMD.N> SEES GRAPHICS AND VISUAL SOLUTIONS REVENUE TO BE DOWNEXPECTS INVENTORY TO BE APPROXIMATELY FLAT FROM FOURTH QUARTER LEVELSCORRECTED-AMD <AMD.N> EXPECTS INVENTORY TO BE APPROXIMATELY FLAT FROM FOURTH QUARTER LEVELS (ADDS SOURCE)RPT-AMD <AMD.N> SEES GRAPHICS AND VISUAL SOLUTIONS REVENUE TO BE DOWNRPT-AMD <AMD.N> SEES COMPUTING SOLUTIONS SEGMENT REVENUE DOWN IN LINE WITH SEASONALITY- CFO, CONF CALL AMD Offers New Levels of Efficiency With 12- and 16-Core Additions to the AMD Opteron 6300 Series <AMD.N>AMD Offers New Levels of Efficiency With 12- and 16-Core Additions to the AMD Opteron 6300 Series <AMD.N>AMD shares set to open 10 pct lower after resultsUPDATE 1-AMD shares fall 11 pct lower after weak revenue forecastAttention Advanced Micro Devices, Inc. Investors: Advanced Micro Devices Misled Investors According to a Newly Filed Class Action <AMD.N>MEDIA ALERT - AMD at Open Compute 2014 <AMD.N>Open Compute Summit to Webcast AMD Keynote <AMD.N>AMD to Accelerate the ARM Server Ecosystem With the First ARM-Based CPU and Development Platform From a Server Processor Vendor <AMD.N>Facebook eyes options for low-power server technologySHAREHOLDER ALERT: Levi & Korsinsky, LLP Announces Class Action Involving ADVANCED MICRO DEVICES, INC. and Its Board of Directors and a Deadline of March 16, 2014 to Seek a Lead Plaintiff Position -- AMD <AMD.N>AMD Delivers Peak Performance for Key Features and Creative Workflows in Latest Photoshop(R) CC Release <AMD.N>AMD to Present at Goldman Sachs Technology & Internet Conference 2014 <AMD.N>Advanced Micro Devices, Inc. Stockholders Encouraged to Contact Securities Law Firm about Investigation <AMD.N>Fitch Affirms AMD's IDR at 'CCC' <AMD.N>FITCH AFFIRMS AMD'S IDR AT 'CCC'"
2014,2,"SHAREHOLDER ALERT: Brower Piven Encourages Investors Who Have Losses in Excess of $100,000 from Investment in Advanced Micro Devices, Inc. to Contact Brower Piven Before the March 17, 2014 Lead Plaintiff Deadline <AMD.N>Harwood Feffer LLP Announces Investigation of Advanced Micro Devices, Inc. <AMD.N>SEMICONDUCTOR INDUSTRY ASSOCIATION SAYS GLOBAL SALES FOR THE MONTH OF DECEMBER 2013 REACHED $26.6 BILLION, MARKING THE STRONGEST DECEMBER ON RECORDAMD Wins Major Communications Excellence Awards in 2013 <AMD.N>Rajaratnam's brother seeks dismissal of insider trading chargesAMD Radeon R9 290X Named Product of the Year at PC Games Hardware Reader's Choice Awards <AMD.N>AMD Embraces Gamers With AMD Rewards Program <AMD.N>Moody's affirms B2 CFR of Advanced Micro Devices; outlook revised to stable from negative <AMD.N>AMD COMMENCES PARTIAL TENDER OFFER FOR ITS 6.00% CONVERTIBLE SENIOR NOTES DUE 2015AMD Commences Partial Tender Offer for Its 6.00% Convertible Senior Notes Due 2015 <AMD.N>AMD COMMENCES PARTIAL TENDER OFFER FOR ITS 8.125% SENIOR NOTES DUE 2017AMD Commences Partial Tender Offer for Its 8.125% Senior Notes Due 2017 <AMD.N>Moody's assigns B2 rating to senior unsecured notes of Advanced Micro Devices; outlook stable <AMD.N>FITCH RATES AMD'S PRIVATE PLACEMENT SENIOR NOTES 'CCC/RR4'AMD Announces Pricing of Private Offering of $600 Million of Senior Notes <AMD.N>AMD ANNOUNCES PRICING OF PRIVATE OFFERING OF $600 MILLION OF SENIOR NOTESAMD Brings Immersive Graphics to Embedded Applications With the New AMD Embedded Radeon(TM) E8860 GPU <AMD.N>AMD and BlueStacks to Bring New Dual-OS Android Solution to Retail <AMD.N>Industry-Leading Applications Awarded Certifications to AMD FirePro R5000 GPU Cloud Solution <AMD.N>"
2014,3,"AMD Announces New AM1 Platform <AMD.N>AMD to Host News Conference to Preview Groundbreaking New Solutions for the Professional Graphics Market <AMD.N>ADVANCED MICRO 96 HOUR DEADLINE ALERT: Approximately 96 Hours Remain; Former Louisiana Attorney General and Kahn Swick & Foti, LLC Remind Investors of Deadline in Securities Class Action Lawsuit Against Advanced Micro Device <AMD.N>UPCOMING DEADLINE: Levi & Korsinsky, LLP Announces Class Action Involving ADVANCED MICRO DEVICES, INC. and Its Board of Directors and a Deadline of March 16, 2014 to Seek a Lead Plaintiff Position -- AMD <AMD.N>DATARAM SIGNS AGREEMENT WITH ADVANCED MICRO DEVICES, INC. TO EXPAND PARTNERSHIPDATARAM CORPORATION - HAS SIGNED AN AGREEMENT WITH ADVANCED MICRO DEVICES TO EXPAND MEMORY MANUFACTURING PARTNERSHIP FROM NORTH AMERICA TO WORLDWIDEDATARAM CORPORATION SAYS ORDERS HAVE ALREADY BEEN PLACED AND SHIPPED TO EUROPE AND JAPANDATARAM - CO WILL CONTINUE THE WORLDWIDE ROLLOUT THROUGHOUT THE YEARBRIEF-Dataram signs agreement with Advanced Micro Devices Inc to expand partnershipAMD to Report Fiscal First Quarter Results on April 17, 2014 <AMD.N>AMD Gaming Evolved Expands With Trio of Exclusive Gaming Partnerships <AMD.N>AMD's Mantle API Adopted by Crytek <AMD.N>AMD ANNOUNCES COMPLETION OF PARTIAL TENDER OFFER FOR ITS 6.00% CONVERTIBLE SENIOR NOTES DUE 2015AMD ANNOUNCES COMPLETION OF PARTIAL TENDER OFFER FOR ITS 8.125% SENIOR NOTES DUE 2017AMD Announces Completion of Partial Tender Offer for Its 6.00% Convertible Senior Notes Due 2015 <AMD.N>AMD Announces Completion of Partial Tender Offer for Its 8.125% Senior Notes Due 2017 <AMD.N>AMD APPOINTS NORA DENZEL AND MIKE INGLIS TO ITS BOARD OF DIRECTORSAMD Appoints Nora Denzel and Mike Inglis to Its Board of Directors <AMD.N>AMD Demonstrates Full Support for New DirectX 12 at Game Developer Conference <AMD.N>AMD Partner Program Rewards and Celebrates Global Channel Partners <AMD.N>AMD <AMD.N> CEO RORY READ'S 2013 TOTAL COMPENSATION $8.2 MLN VS $7.3 MLN IN 2012- SEC FILINGAMD <AMD.N> CFO DEVINDER KUMAR'S 2013 TOTAL COMPENSATION $4.2 MLN VS $1.1 MLN IN 2012BRIEF-AMD <AMD.N> CEO rory read's 2013 total compensation $8.2 mlnTechnical Summary on Active Stocks -- Research on Cisco Systems, Pfizer, Vale, and Advanced Micro Devices"
2014,4,"AMD and Mentor Graphics to Accelerate Open-Source Linux Development for Embedded Systems <AMD.N>AMD Amends Wafer Supply Agreement With GLOBALFOUNDRIES <AMD.N>AMD <AMD.N> SAYS UNDER THIS AMENDMENT AMD EXPECTS TO PAY GLOBALFOUNDRIES APPROXIMATELY $1.2 BILLION IN 2014AMD <AMD.N> SAYS THE 2014 AMENDMENT DOES NOT IMPACT AMD'S 2014 FINANCIAL GOALS INCLUDING GROSS MARGINBRIEF-AMD amends wafer supply deals with GLOBALFOUNDRIESDATARAM CORP <DRAM.O> SAYS SALES ORDERS HAVE ALREADY BEEN RECEIVED AND SHIPPED BY ELYSIUM AND DATARAM UNDER THIS AGREEMENTBRIEF-Dataram signs sales agreement with Elysium Europe LtdAMD's Lisa Su Named UBM Executive of the Year <AMD.N>AMD APUs and GPUs Accelerate Latest Creative Tools and Productivity Enhancements for Adobe Creative Cloud Professional Video Workflows <AMD.N>Reuters Insider - Companies punt on CEO perksAMD Flagship Professional Graphics Deliver the Ultimate Real-Time 4K Experience for Next Generation Workstations <AMD.N>AMD to Host Hybrid Annual Meeting of Stockholders <AMD.N>AMD Launches World's Fastest Graphics Card <AMD.N>AMD Introduces New Socketed AMD Sempron and AMD Athlon APU Products With AM1 Platform <AMD.N>Mantle Takes to the Stars With Sid Meier's Civilization: Beyond Earth <AMD.N>AMD Showcases Server Innovation and Industry First With a Demo of Its Next-Gen x86 APU Running Fedora Linux <AMD.N>AMD <AMD.N> Q1 SHR VIEW $0.00 -- THOMSON REUTERS I/B/E/SAMD <AMD.N> Q1 NON-GAAP SHR $0.02AMD REPORTS 2014 FIRST QUARTER RESULTSAMD <AMD.N> Q1 REVENUE $1.4 BLN VS I/B/E/S VIEW $1.34 BLNAMD <AMD.N> SEES Q2 2014 REVENUE UP ABOUT 3 PCTAMD <AMD.N> Q1 SHR LOSS $0.03AMD Reports 2014 First Quarter Results <AMD.N> - Part 2AMD Reports 2014 First Quarter Results <AMD.N> - Part 1AMD <AMD.N> SAYS FOR THE SECOND QUARTER OF 2014, AMD EXPECTS REVENUE TO INCREASE 3 PERCENT, PLUS OR MINUS 3 PERCENT, SEQUENTIALLY AMD <AMD.N> SHARES UP 3 PCT AFTER THE BELL FOLLOWING RESULTSAMD <AMD.N> Q1 GROSS MARGIN 35 PERCENT PERCENT VS. 41 PERCENTAMD <AMD.N> Q2 REV VIEW $1.36 BLN -- THOMSON REUTERS I/B/E/SBRIEF-AMD Q1 non-GAAP EPS $0.02Chipmaker AMD posts net loss for first quarterUPDATE 1-Chipmaker AMD's quarterly results beat expectationsADVANCED MICRO DEVICES INC <AMD.N> CEO SAYS EXPECTS TO DELIVER PC REV GROWTH IN COMING QUARTERS OF 2014BRIEF-AMD expects PC revenue growth in coming quarters of 2014AMD CEO SAYS EXPECTS TO GAIN MARKET SHARE IN PCS AS OVERALL MARKET DECLINES IN 2014U.S. DISTRICT JUDGE NAOMI REICE BUCHWALD SAYS INDICTMENT  ADEQUATELY ALLEGES ELEMENTS OF CRIMES CHARGEDU.S. JUDGE DENIES BID BY GALLEON GROUP FOUNDER'S BROTHER RENGAN  RAJARATNAM TO DISMISS INSIDER TRADING CASERajaratnam's brother loses bid to dismiss insider trading chargesCORRECTED-UPDATE 1-Rajaratnam's brother loses bid to dismiss insider trading chargesAMD SHARES UP 7.1 PCT PREMARKET AFTER POSTING UPBEAT RESULTS  LAST WEEKAMD Energizes \\""Never Settle Forever\\"" <AMD.N>Reuters Insider - Techquity: Apple vs. Google, Facebook's ad playAMD to Host Core Innovation Update News Conference <AMD.N>AMD and Toronto-Area Middle School Strengthen Technology Skills through Game Design <AMD.N>AMD to Present at J.P. Morgan Global Technology, Media and Telecom Conference <AMD.N>Next-Generation Mobile APUs Extend AMD Performance Leadership, Add Cutting-Edge Features and Enhanced Security <AMD.N>EMBEDDED LINUX YOCTO PROJECT(TM) ANNOUNCES AMD AND MENTOR GRAPHICS AS NEW ADVISORY BOARD MEMBERSEmbedded Linux Yocto Project(TM) Announces AMD and Mentor Graphics as New Advisory Board Members <AMD.N>"
2014,5,"AMD's Revolutionary SeaMicro SM15000(TM) Server Named 2014 Silver Edison Award Winner <AMD.N>U.S. prosecutors to drop two of seven charges against Rajaratnam's brotherAMD Unveils Ambidextrous Computing Roadmap <AMD.N>-EU court to rule June 12 on Intel challenge to $1.5 bln EU fine Semiconductor Industry Announces Financial Results, Upcoming Earnings Schedules, and Conferences - Analyst Notes on Avago, AMD, Maxim Integrated, Atmel and CaviumAMD to Present at Bank of America Merrill Lynch Global Technology Conference <AMD.N>AMD's SeaMicro SM15000(TM) Server Sets Industry Benchmark Record for Hyperscale OpenStack Clouds <AMD.N>Semiconductors Stocks Highlight -- Research on Intel, Advanced Micro Devices, Maxim Integrated Products, and Cypress SemiconductorU.S. prosecutors drop two more charges against Rajaratnam's brotherAMD Embeds Intelligent, Interactive and Immersive Experiences With 2nd Generation AMD Embedded R-Series APUs and CPUs <AMD.N>AMD Honors Suppliers for Commitment and Quality of Service at 2014 Supplier Day <AMD.N>"
