2011,4,"AMD AMENDS WAFER SUPPLY AGREEMENT WITH GLOBALFOUNDRIES AND DISCLOSES GLOBALFOUNDRIES INVESTMENT-RELATED NONCASH GAIN OF $492 MILLION AMD Amends Wafer Supply Agreement With GLOBALFOUNDRIES and Discloses GLOBALFOUNDRIES Investment-Related Noncash Gain of <AMD.N> AMD to Host a Webcast in Relation to the Amendment of Its Wafer Supply Agreement With GLOBALFOUNDRIES <AMD.N>AMD SAYS TO PURCHASE FIXED NUMBER OF 45NM AND 32NM WAFERS PER QUARTER FROM GLOBALFOUNDRIESBRIEF-AMD expects Q1 gain after wafers amendmentUPDATE 1-AMD sees $492 mln gain after Globalfoundries dilutionBRIEF-SIA reports February global chip sales of $25.2 billionAMD <AMD.N> SAYS AMENDED WAFER SUPPLY AGREEMENT WITH GLOBALFOUNDRIESAMD <AMD.N> SAYS WILL PAY GF A FIXED PRICE FOR 45NM WAFERS DELIVERED IN 2011 - SEC FILINGAMD- CURRENTLY ESTIMATE TO PAY GF ABOUT $1.1-$1.5 BILLION IN 2011;$1.5-$1.9 BILLION IN 2012 FOR WAFER PURCHASES UNDER AGREEMENTAMD <AMD.N> SAYS NOT ABLE TO MEANINGFULLY QUANTIFY OR ESTIMATE PURCHASE OBLIGATIONS TO GF BEYOND 2012AMD <AMD.N> SAYS WILL RECOGNIZE A NON-CASH GAIN, NET OF CERTAIN COSTS, OF APPROXIMATELY $492 MILLION IN Q1 OF 2011BRIEF-AMD says amended wafer supply agreement with GlobalfoundriesMubadala to test Gulf debt appetite with bond saleUPDATE 1-Edwards set to price IPO at bottom of range-sources AMD and Vizrt Collaborate to Power Immersive Viz Video Wall Experiences <AMD.N>Rajaratnam defense to present its case for NY jury AMD Fusion Technology and Discrete Graphics Accelerate Award-Winning Sony Vegas Pro Video Production Software <AMD.N> AMD Empowers Content Creators to Bring Their Visions to Life at NAB Show 2011 <AMD.N>UPDATE 1-Mubadala plans dual-tranche benchmark dollar bond AMD Foundation Awards Game Design Education Grants to Two Austin Recipients <AMD.N>U.S. stings Rajaratnam with phone tap to end caseUPDATE 1-U.S. stings Rajaratnam with phone tap to end caseINTEL CORP <INTC.O> SEES Q2 REVENUE: $12.8 BILLION, PLUS OR MINUS $500 MILLIONINTEL CORP <INTC.O> SEES 2011 SPENDING (R&D PLUS MG&A): $15.7 BILLION, PLUS OR MINUS $200 MILLIONINTEL CORP <INTC.O> SEES Q2 R&D PLUS MG&A SPENDING: APPROXIMATELY $3.9 BILLIONINTEL CORP <INTC.O> SEES 2011 GROSS MARGIN PERCENTAGE: 63 PERCENT, PLUS OR MINUS A FEW PERCENTAGE POINTSINTEL CORP <INTC.O> SEES Q2 IMPACT OF EQUITY INVESTMENTS AND INTEREST AND OTHER: GAIN OF APPROXIMATELY $50 MILLIONINTEL CORP <INTC.O> QTRLY NON-GAAP GROSS MARGIN OF 62 PERCENTINTEL CORP <INTC.O> SEES Q2 GROSS MARGIN PERCENTAGE: 61 PERCENT, PLUS OR MINUS A COUPLE PERCENTAGE POINTSINTEL CORP <INTC.O> Q2 REV VIEW $11.87 BLN -- THOMSON REUTERS I/B/E/SINTEL CORP <INTC.O> QTRLY NON-GAAP EARNINGS PER SHARE 59 CENTSINTEL CORP <INTC.O> SEES GREATER THAN 20 PERCENT ANNUAL REVENUE GROWTHRPT-AUTO ALERT - INTEL CORP <INTC.O> Q1 SHR VIEW $0.46 -- THOMSON REUTERS I/B/E/SCORRECTED-INTEL CORP <INTC.O> SEES Q2 NON-GAAP (NOT GAAP) GROSS MARGIN FORECAST 62 PERCENT PLUS OR MINUS A COUPLE PERCENTAGE POINTSRPT-AUTO ALERT - INTEL CORP <INTC.O> Q1 SHR $0.56RPT-INTEL CORP <INTC.O> SEES Q2 R&D PLUS MG&A SPENDING: APPROXIMATELY $3.9 BILLIONRPT-INTEL CORP <INTC.O> SEES Q2 IMPACT OF EQUITY INVESTMENTS AND INTEREST AND OTHER: GAIN OF APPROXIMATELY $50 MILLIONRPT-INTEL CORP <INTC.O> SEES 2011 CAPITAL SPENDING: $10.2 BILLION, PLUS OR MINUS $400 MILLIONRPT-INTEL CORP <INTC.O> SEES Q2 REVENUE: $12.8 BILLION, PLUS OR MINUS $500 MILLIONRPT-INTEL CORP <INTC.O> QTRLY NON-GAAP GROSS MARGIN OF 62 PERCENTRPT-INTEL CORP <INTC.O> SEES 2011 GROSS MARGIN PERCENTAGE: 63 PERCENT, PLUS OR MINUS A FEW PERCENTAGE POINTSRPT-INTEL CORP <INTC.O> QTRLY NON-GAAP EARNINGS PER SHARE 59 CENTSRPT-INTEL CORP <INTC.O> Q2 REV VIEW $11.87 BLN -- THOMSON REUTERS I/B/E/SRajaratnam trial rivals to make last pitch to juryUPDATE 1-Intel jumps as brokerages up price target on strong outlookRPT-UPDATE 1-Intel jumps as brokerages up price target on strong outlookUPDATE 2-Intel shares rise on strong forecastUPDATE 5-Rajaratnam guilt 'overwhelming'-US closes at trialUPDATE 7-Jury shown 2 faces of Rajaratnam in closing wordsDefense presses trial jury to acquit Rajaratnam AMD Reports First Quarter Results <AMD.N>AMD <AMD.N> QTRLY GROSS MARGIN 43 PERCENT, NON-GAAP GROSS MARGIN 45 PERCENTAMD <AMD.N> SAYS EXPECTS REVENUE TO BE FLAT TO SLIGHTLY DOWN SEQUENTIALLY FOR THE SECOND QUARTER OF 2011.UPDATE 1-AMD posts quarterly revenue in line with StreetUPDATE 2-Rajaratnam defense in last shot to urge acquittalADVANCED MICRO DEVICES INC <AMD.N> EXEC SAYS BOARD HAPPY WITH INTEREST RECEIVED FOR CEO POSITIONUPDATE 3-AMD posts quarterly earnings above expectationsADVANCED MICRO DEVICES CFO SAYS BOARD INTERVIEWING CANDIDATES FOR CEO JOBADVANCED MICRO DEVICES INC <AMD.N> CFO SAYS CURRENT QUARTER SALES SEEN FLAT TO DOWN 5 PCT SEQUENTIALLYBRIEF-AMD happy with interest received for CEO positionUPDATE 4-AMD beats expectations, interviews would-be CEOsUPDATE 5-AMD beats expectations, rolls out new chips AMD Embedded G-Series Platform Gets Real-Time Operating System Support From Express Logic <AMD.N> AMD Announces Thought Leaders From ARM and Microsoft to Be Among Keynote Speakers at AMD Fusion Developer Summit <AMD.N>AMD ANNOUNCES THOUGHT LEADERS FROM ARM AND MICROSOFT TO BE AMONG KEYNOTE SPEAKERS AT AMD FUSION DEVELOPER SUMMITSTOCKS NEWS US-Advanced Micro attracts June call option buyer AMD and MulticoreWare Team to Help Developers Optimize the Use of OpenCL(TM) for AMD Fusion APUs <AMD.N> AMD Raises the Bar on Sub-$100 Graphics Performance and Image Quality <AMD.N>ARM HOLDINGS <ARM.L> CFO SAYS CLEARLY MORE THAT ARM AND AMD COULD DO TOGETHER OVER TIMESMSC INTER-CHIP CONNECTIVITY TECHNOLOGY LICENSED BY AMD"
2011,5," AMD Delivers First Embedded GPU Offering Support for OpenCL(TM) and Six Independent Displays <AMD.N>UPDATE 1-Rajaratnam absent from court as jurors deliberateUPDATE 2-Rajaratnam has infected foot, absent as jury meetsUPDATE 2-Rajaratnam juror excused, jury begins anewUPDATE 3-Rajaratnam absence, jury change unsettles trial AMD to Present at J.P. Morgan Technology, Media and Telecom Conference <AMD.N>Rajaratnam jury asks for Chiesi phone tap replaysBRIEF-Total silicon wafer area Q1 shipments fall sequentially - SEMI AMD and Acceleware Collaborate to Offer OpenCL(TM) Education <AMD.N><AXE.V> AMD Fusion APU Receives \\""Best in Show\\"" Award at Embedded Systems Conference <AMD.N> AMD Highlights State of Cloud Adoption and Emerging IT Demands in Europe and Asia <AMD.N> AMD and Dell Offer New Multifunctional Server Solution for Compute, Professional Graphics and VDI <AMD.N> In Abu Dhabi, Advanced Micro Devices Outlines AMD Fusion APU Benefits <AMD.N> Live Webcast From COMPUTEX 2011: AMD to Detail Plans to Continue Enabling the Next Generation of PC User Experiences <AMD.N> New AMD Embedded G-Series APUs Provide 39 Percent Power Reduction for Fanless Designs <AMD.N> AMD Fusion Accelerated Processing Units Win 2011 Best Choice of COMPUTEX TAIPEI Award <AMD.N> AMD FirePro Professional Graphics Get Even Better, Outperform Competition by 100 Percent <AMD.N>"
2011,6," AMD Global Cloud Study Reveals Growing Trust in Cloud Computing as Businesses Achieve Measurable Value <AMD.N> AMD Paves the Way for the Next Generation of Supercharged Desktop PCs With 9-Series Chipsets <AMD.N> Live Webcasts From AMD Fusion Developer Summit: Keynote Presenters to Outline Technology Vision for Software Developers <AMD.N> AMD Reintroduces FX Brand for High-End Processors and Platforms at E3 <AMD.N> AMD Opteron(TM) 6000 Series Platform Increases Reach, Demonstrates Virtualization Prowess, Drives Toward Core-Rich <AMD.N>SEMI-FAB CONSTRUCTION SPENDING DECELERATES THIS YEAR AND IN 2012 AMD and Nintendo Join Forces in Creating a New Way to Enjoy Console Gaming Entertainment <AMD.N>AMD AND NINTENDO JOIN FORCES IN CREATING A NEW WAY TO ENJOY CONSOLE GAMING ENTERTAINMENTUPDATE 5-Nintendo lifts lid on Wii U, seeks hardcore gamers AMD and Leading Software Vendors Continue to Expand Offerings Optimized for OpenCL(TM) Standard <AMD.N> AMD and ViVu Join Forces to Bring Vivid, Next-Generation PC Video Experiences to Life <AMD.N>ANALYSIS-India still seeking fab formula for chipmakersUPDATE 1-AMD's new chips could force Intel to cut prices-Macquarie AMD Unveils New Software Tools Designed to Accelerate the Development of Brilliant Computing Experiences <AMD.N>CSOFT Hosts AMD, Comtech, Geller Translation and Others at 8th Annual World Localization... <AMD.N>Chiesi seeks leniency after insider trading plea Hardware and Software Leaders Fulfill Promise of Brilliant Experiences and New PC Capabilities With AMD A-Series APU <AMD.N> AMD Celebrates Innovation With VISIONary of the Year Award Winners <AMD.N> AMD Ushers in Next Generation of Computing With AMD A-Series APUs <AMD.N>BRIEF-HP introduces 11 new notebook models AMD Details Future Technical Roadmap for Its Award Winning Fusion Architecture at Industry Developer Summit <AMD.N> AMD Launches Contest for Developers to Create Heterogeneous Compute Applications <AMD.N> AMD and Academic Experts Collaborate With Morgan Kaufmann Publishers on OpenCL(TM) Book <AMD.N>FBR CUTS INTEL CORP <INTC.O> PRICE TARGET TO $26 FROM $27ABU DHABI'S ATIC SAYS TO INVEST ABOUT $6 BLN IN MANUFACTURING CAPACITY IMPROVEMENT THROUGH END 2012ATIC SAYS TO ENHANCE CAPACITY IN DRESDEN, SINGAPORE AND NEW YORK; INITIAL CONSTRUCTION TO START IN ABU DHABIBRIEF-ATIC names Ajit Manocha interim CEO for Globalfoundries; eyes more investmentATIC and GLOBALFOUNDRIES Announce New Leadership to Drive Continued Investment Through 2012 <AMD.N>NORTH AMERICA-BASED MANUFACTURERS OF SEMICONDUCTOR EQUIPMENT POSTED $1.62 BILLION IN ORDERS IN MAY, UP 1.1 PCT FROM APRIL - SEMIZacks' Voice of the People Highlights Opportunities With Intel, Goldman Sachs and Advanced Micro Devices <AMD.N><GS.N><INTC.O> AMD Sees 15 Percent Growth in Six Months on Newest List of TOP500 Supercomputers <AMD.N>AMD SEES 15 PERCENT GROWTH IN SIX MONTHS ON NEWEST LIST OF TOP500 SUPERCOMPUTERSBoys & Girls Clubs of America, AMD Grow Partnership to Expand Youth Game Design Program <AMD.N> AMD Will Not Endorse SYSmark 2012 Benchmark <AMD.N>ARASAN CHIP SYSTEMS APPOINTS DIRECTOR OF SALES, NORTH AMERICA Media Alert: AMD A-Series Desktop Processors Set the APU Bar <AMD.N>EVERCORE STARTS INTERSIL CORP <ISIL.O> WITH EQUAL-WEIGHT RATING; PRICE TARGET OF $13EVERCORE STARTS NVIDIA CORP <NVDA.O> WITH UNDERWEIGHT RATING; PRICE TARGET OF $12"
2011,7," AMD Second Quarter 2011 Results to Be Announced on July 21 <AMD.N>NI Technology Updates Outlooks for Advanced Micro Devices, Altera, Xilinx, Atmel, and Cypress Semiconductor AMD Launches AMD Radeon(TM) HD 6990M -- World's Fastest Single Mobile Graphics Processor <AMD.N>ANALYSIS-Guilty pleas hint at next steps in US insider casesUPDATE 3-Danielle Chiesi settles SEC insider trading casePREVIEW-Ex-trader Chiesi awaits fate in Galleon insider caseNI Technology Previews Earnings for Intel, Qualcomm, Advanced Micro Devices, Cypress Semiconductor and Flextronics Robert Rodriguez to Announce Collaboration Between Quick Draw Productions and AMD <AMD.N>RPT-PREVIEW-Ex-trader Chiesi awaits fate in Galleon insider caseUPDATE 2-Intel expects solid Q3, shares gainUPDATE 4-Intel expects solid quarter, beats StreetAUTO ALERT - AMD <AMD.N> Q2 REVENUE $1.57 BLN VS I/B/E/S VIEW $1.58 BLNAMD <AMD.N> Q2 NON-GAAP SHR $0.09 AMD Reports Second Quarter Results <AMD.N>AMD <AMD.N> QTRLY GROSS MARGIN WAS 46 PERCENT.AMD <AMD.N> SAYS EXPECTS REVENUE TO INCREASE 10 PERCENT, PLUS OR MINUS 2 PERCENT, SEQUENTIALLY FOR THE THIRD QUARTER OF 2011AMD <AMD.N> SAYS MICROPROCESSOR ASP DECREASED SEQUENTIALLY AND YEAR-OVER-YEARADVANCED MICRO DEVICES INC <AMD.N> SHARES UP 3 PCT AFTER THE BELLCORRECTED-AMD <AMD.N> SAYS EXPECTS REVENUE TO INCREASE 10 PERCENT, PLUS OR MINUS 2 PERCENT, SEQUENTIALLY FOR THE THIRD QUARTER OF 2011 (CLARIFIES FORECAST WAS SEQUENTIAL, NOT YOY)RPT-AUTO ALERT - AMD <AMD.N> Q2 REVENUE $1.57 BLN VS I/B/E/S VIEW $1.58 BLNRPT-AMD <AMD.N> Q2 SHR $0.08RPT-AMD <AMD.N> QTRLY GROSS MARGIN WAS 46 PERCENT.AMD <AMD.N> Q3 REV VIEW $1.70 BLN -- THOMSON REUTERS I/B/E/SBRIEF-Advanced Micro Devices shares up 4.6 percent after the bellUPDATE 1-AMD's quarterly outlook boosts stockBRIEF-AMD <AMD.N> Q2 resultsUPDATE 2-AMD's outlook impresses Street, stock jumpsADVANCED MICRO DEVICES <AMD.N> EXEC SAYS SEARCH FOR A NEW CEO REMAINS A TOP PRIORITYADVANCED MICRO DEVICES <AMD.N> EXEC SAYS BOARD PLEASED WITH QUALITY OF CANDIDATES INTERVIEWEDADVANCED MICRO DEVICES <AMD.N> EXEC SAYS TIMELINE NOT DRIVING FORCE IN SEARCH FOR NEW CEOAMD EXEC SAYS BELIEVES CEO SEARCH IS MOVING IN A \\""FINE DIRECTION\\"", WON'T SET TIMELINEAMD EXEC SAYS EXPECTS GROSS MARGINS IN Q3 WILL BE UP 1 PERCENTUS seeks about 4-5 yrs prison for ex-SAC managerADVANCED MICRO DEVICES INC <AMD.N> UP 7.9 PCT PREMARKET AFTER RESULTS LATE THURSDAYBRIEF-Advanced Micro Devices jumps after resultsUS STOCKS-Futures dip after weak Caterpillar earningsReuters Insider - Inside the News: Heat is on -- for debt talks & Murdoch, tooUS RESEARCH SUMMARY-S&P 500 July 22 2202 GMT AMD to Present at Pacific Crest Global Technology Leadership Forum <AMD.N>"
2011,8," AMD Teams With NYSERDA, HP, and Clarkson University for Sustainable Data Center Energy Research <AMD.N>Q2 TOTAL SILICON WAFER AREA SHIPMENTS WERE 2,392 MILLION SQUARE INCHES, UP 5 PCT SEQUENTIALLY - SEMI AMD Opens the Throttle on APU Performance With Updated OpenCL Software Development Kit <AMD.N> AMD Collaborates With Autodesk to Enable Easier and Faster Programming for Game Developers and 3D Artists <AMD.N>US RESEARCH SUMMARY-S&P 500 Aug 11 1136 GMTUS RESEARCH SUMMARY-S&P 500 Aug 11 2155 GMT AMD Releases Software Kit to Accelerate the Development of Stereo 3D <AMD.N> Robert Rodriguez Harnesses AMD Technology to Bring Brilliant Graphics and Outstanding Visual Fidelity to Latest \\""Spy <AMD.N>ARASAN CHIP SYSTEMS ANNOUNCES ADDITIONAL SALES TERRITORY IN TURKEY AMD Boosts Its AMD Fusion APUs for Notebooks, Ultrathins, All-in-Ones and Desktops <AMD.N> AMD to Present at Citi Technology Conference <AMD.N>AMD NAMES RORY P. READ PRESIDENT AND CEO AMD Names Rory P. Read President and CEO <AMD.N>AMD <AMD.N> SAYS READ HAS ALSO BEEN APPOINTED TO THE COMPANY'S BOARD OF DIRECTORS.AMD <AMD.N> SAYS READ JOINS AMD FROM LENOVO GROUP, LTDBRIEF-AMD appoints CEOUPDATE 1-AMD ends CEO search, hires Lenovo veteranAMD -CEO RORY P. READ ENTITLED TO INITIAL ANNUAL BASE SALARY OF $1 MLNAMD - EFFECTIVE JAN 1, 2012, READ ENTITLED TO AN ANNUAL PERFORMANCE BONUS AT A TARGET AMOUNT OF 150% OF BASE SALARY - SEC FILINGBRIEF-AMD CEO compensationUPDATE 2-AMD ends CEO search, hires Lenovo veteranUPDATE 3-AMD ends CEO search, hires Lenovo executive AMD Delivers Cloud Computing Expertise at VMworld 2011 <AMD.N> AMD to Present at Deutsche Bank Securities Technology Conference <AMD.N>UPDATE 1-Salesman 'knew full well' he passed inside tips-USUPDATE 2-Salesman 'knew full well' he passed inside tips-US"
2011,9,"THE GLOBAL SUPPLY CHAIN LEADERS GROUP (GSCLG) IS PLEASED TO ANNOUNCE THAT MICHAEL MASSETTI, CORPORATE VICE PRESIDENT, INTEGRATED SUPPLY CHAIN OF ADVANCED MICRO DEVICES, INC. (NYSE: AMD), HAS BEEN NAMED THE SUPPLY CHAIN EXECUTIVE OF THE YEAR The Global Supply Chain Leaders Group (GSCLG) Is Pleased to Announce That Michael Massetti, Corporate Vice President, <AMD.N> AMD FirePro(TM) Professional Graphics Certified for New OpenCL(TM) Compliant 3D Modeling Application <AMD.N> AMD Ships First \\""Bulldozer\\"" Processors <AMD.N>AMD SHIPS FIRST \\""BULLDOZER\\"" PROCESSORSAMD SAYS MANY OF THE INITIAL SHIPMENTS HAVE BEEN EARMARKED FOR LARGE CUSTOM SUPERCOMPUTER INSTALLATIONS THAT ARE NOW UNDERWAYAMD - INITIAL PRODUCTION OF THE PROCESSOR, CODENAMED \\""INTERLAGOS,\\"" BEGAN IN AUGUST AND SHIPPING TO CUSTOMERS IS ALREADY UNDERWAYBRIEF-AMD says ships first \\""bulldozer\\"" processorsJP MORGAN CUTS ANALOG DEVICES <ADI.N> PRICE TARGET TO $37 FROM $40; RATING OVERWEIGHTJP MORGAN CUTS CYPRESS SEMICONDUCTOR <CY.O> PRICE TARGET TO $10 FROM $13; RATING UNDERWEIGHTJP MORGAN CUTS TEXAS INSTRUMENTS <TXN.N> PRICE TARGET TO $30 FROM $44; RATING OVERWEIGHT AMD Joins Forces With Broadcast Technology Leaders to Overhaul Real-Time Video Workflows <AMD.N> AMD Showcases World's Fastest CPU <AMD.N> / CORRECTION - AMD Showcases World's Fastest CPU <AMD.N> AMD Set to Deliver Next Generation x86 Platforms for Windows 8 <AMD.N>AMD SET TO DELIVER NEXT GENERATION X86 PLATFORMS FOR WINDOWS 8MOODY'S ASSIGNS A1 RATING TO INTEL'S SENIOR UNSECURED DEBT. <AMD.N>MOODY'S ASSIGNS A1 RATING TO INTEL'S SENIOR UNSECURED DEBT.BRIEF-North American August chip-gear orders fall 8.8 pct vs July- SEMI AMD Celebrates Worldwide \\""AMD VISION Challenge\\"" Finalists <AMD.N>BRIEF-RESEARCH ALERT-BofA Merrill raises price targets on AMD, 2 others AMD Announces Financial Analyst Day <AMD.N>Ex-Primary Global manager guilty in insider caseUPDATE 1-Ex-Primary Global manager guilty in insider case AMD Announces Executive Changes <AMD.N>BRIEF-AMD announces executive changesUPDATE 1-AMD product division head resigns AMD Delivers Multi-Display Support With Longevity on Latest Entry-Level Embedded Discrete GPU <AMD.N>UBS CUTS DISH NETWORK CORP <DISH.O> PRICE TARGET TO $29 FROM $33UBS CUTS HP <HPQ.N> PRICE TARGET TO $24.5 FROM $29UBS RAISES MARVELL TECHNOLOGY <MRVL.O> PRICE TARGET TO $19.5 FROM $18ADVANCED MICRO DEVICES <AMD.N> UP 3.9 PCT PREMARKET AFTER UBS UPGRADES TO BUYBRIEF-Advanced Micro Devices up in premarket after upgradeUS STOCKS-Wall St set to rise on hopes of euro zone movesNI Technology Updates Outlooks for Advanced Micro Devices, Altera, Xilinx, Micron and SanDiskUS STOCKS-Wall St mixed on weak housing data, Europe woes AMD Announces Preliminary Third Quarter Results <AMD.N>AMD ANNOUNCES PRELIMINARY THIRD QUARTER RESULTSAMD <AMD.N> SAYS  EXPECTS THIRD QUARTER GROSS MARGIN TO BE APPROXIMATELY 44 TO 45 PERCENTAMD <AMD.N> SAYS Q3 REV IS EXPECTED TO INCREASE FOUR TO SIX PERCENT AS COMPARED TO THE SECOND QUARTER OF 2011AMD <AMD.N> SAYS PREVIOUSLY FORECAST Q3 REVENUE TO INCREASE 10% , PLUS OR MINUS TWO PERCENT, FROM THE SECOND QUARTER OF 2011BRIEF-AMD preliminary Q3 resultsBRIEF-Synaptics appoints Rick Bergman as CEOUPDATE 1-AMD cuts Q3 rev, margin; shares fallTEXT-Fitch recovery analyses for U.S. technology sectorUPDATE 1-Synaptics names former AMD unit head CEOUPDATE 2-AMD cuts Q3 rev view on supply issues; shares fallUS STOCKS-Futures rise after German vote, US data on tapUS STOCKS-Futures rise on German vote, Bernanke; data on tapSTOCKS NEWS US-Wall St frowns on AMD's weak Q3 outlookUPDATE 2-Micron Tech posts surprise Q4 loss on lower marginsUPDATE 3-Micron Q4 misses as pricing pressures hit margins "
2011,10," AMD Demonstrates Next Generation 28nm Graphics Processor at Fusion 2011 <AMD.N>CITIGROUP CUTS SPANSION INC <CODE.N> PRICE TARGET TO $14 FROM $15.50CITIGROUP CUTS INTEL CORP <INTC.O> PRICE TARGET TO $25 FROM $26CITIGROUP CUTS QUALCOMM INC <QCOM.O> PRICE TARGET TO $62 FROM $63BRIEF-RESEARCH ALERT-Citigroup cuts price target on Intel, AMD, othersUPDATE 1-TSMC, UMC post big declines in Sept revenuesSEMI - EXPECTS POLISHED AND EPITAXIAL SILICON SHIPMENTS TOTALING 9,131 MILLION SQUARE INCHES IN 2011 Unlock Your Record Setting AMD FX Series Processor Today <AMD.N>BRIEF-RESEARCH ALERT-Sterne Agee cuts price targets on Intel, AMD AMD Appoints Mark Papermaster as Senior Vice President and Chief Technology Officer <AMD.N>BRIEF-AMD appoints Senior VP, CTOUPDATE 1-AMD appoints Mark Papermaster as CTO UPDATE 2-Intel shares jump on outlook AMD and BlueStacks Join Forces to Bring Android Apps to x86-Based Tablets and PCs <AMD.N> MotionDSP Taps AMD and OpenCL(TM) Industry Standard for Fast Processing of Ikena ISR Video Software <AMD.N>The Portland Group Adds Support for AMD's \\""Bulldozer\\"" Architecture <AMD.N>AMD <AMD.N> Q3 NON-GAAP SHR $0.15AMD <AMD.N> Q3 SHR VIEW $0.10 -- THOMSON REUTERS I/B/E/SAMD <AMD.N> AMD EXPECTS REVENUE TO INCREASE 3 PERCENT, PLUS OR MINUS 2 PERCENT, SEQUENTIALLY FOR THE FOURTH QUARTER OF 2011.ADVANCED MICRO DEVICES INC <AMD.N> SHARES UP 6.3 PCT AFTER THE BELLBRIEF-Advanced Micro Devices shares up 6.3 percent after the bellRPT-UPDATE 2-Chipmaker AMD posts higher quarterly revADVANCED MICRO DEVICES INC <AMD.N> CEO SAYS NOT \\""OUT OF WOODS\\"" ON EXECUTION SETBACK BUT IMPROVINGADVANCED MICRO DEVICES CFO SAYS SEES NO IMPACT FROM THAILAND FLOODS AND HARD DRIVE SHORTAGE ON Q4 RESULTSUPDATE 3-Chipmaker AMD results beat expectationsBRIEF-AMD says not \\""out of woods\\"" on execution setback but improvingUPDATE 4-Chipmaker AMD says resolving output problem"
2011,11," AMD FirePro(TM) V4900 Professional Graphics Card Delivers Best-in-Class Features, Performance and Unparalleled Value <AMD.N> AMD Optimizes Cost Structure to Enhance Competitiveness and Accelerate Growth <AMD.N>AMD OPTIMIZES COST STRUCTURE TO ENHANCE COMPETITIVENESS AND ACCELERATE GROWTHAMD <AMD.N> SAYS  WORKFORCE REDUCTION WILL OCCUR ACROSS ALL FUNCTIONS GLOBALLYAMD <AMD.N> SAYS TO CUTT WORKFORCE BY ABOUT 10 PCTAMD - WORKFORCE REDUCTION WILL OCCUR ACROSS ALL FUNCTIONS GLOBALLY,EXPECTED TO BE SUBSTANTIALLY COMPLETED BY THE END OF THE Q1AMD <AMD.N> SAYS WORKFORCE REDUCTION IS EXPECTED TO BE SUBSTANTIALLY COMPLETED BY THE END OF THE FIRST QUARTER OF 2012AMD <AMD.N> SAYS EXPECTS THAT THE RESTRUCTURING PLAN WILL RESULT IN OPERATIONAL SAVINGS OF APPROXIMATELY $10 MILLION IN Q4AMD <AMD.N> SAYS EXPECTS FOURTH QUARTER 2011 OPERATING EXPENSES WILL BE APPROXIMATELY $610 MILLIONAMD <AMD.N> SAYS EXPECTS THAT THE RESTRUCTURING PLAN WILL RESULT IN OPERATIONAL SAVINGS OF APPROXIMATELY $118 MILLION IN 2012AMD <AMD.N> - EXPECTS TO SAVE APPROXIMATELY $90 MILLION IN 2012 OPERATING EXPENSES IN ADDITION TO THE RESTRUCTURING PLAN SAVINGSAMD <AMD.N> SAYS ESTIMATES TO RECORD RESTRUCTURING EXPENSE IN Q4 AND IN 2012 OF APPROXIMATELY $101 MLN AND $4 MLN, RESPECTIVELYBRIEF-AMD announces restructuring plan AMD to Report Results for the Fiscal Quarter and Year Ending December 31, 2011 on January 24, 2012 <AMD.N> AMD Ready Solutions for Server Help Accelerate Data Center Deployments <AMD.N> New AMD Opteron(TM) Processors Deliver the Ultimate in Performance, Scalability and Efficiency <AMD.N>Supermicro Advanced A+ Supercomputing Platforms Break New Ground With New 16-Core AMD Opteron Processors <AMD.N><SMCI.O>Supermicro� Advanced A+ Supercomputing Platforms Break New Ground With New 16-Core AMD Opteron� Processors <AMD.N><SMCI.O> AMAX Scales Performance With the World's Only 16-Core x86 CPU: The AMD Opteron(TM) 6200 Series Processor <AMD.N> NCSA, Cray Partner on Sustained-Petascale Blue Waters Supercomputer <AMD.N><CRAY.OQ><NVDA.O> Cray Inc. Lands $188 Million Contract and Releases 2012 Outlook <AMD.N><CRAY.OQ><NVDA.O>CRAY INC <CRAY.O> SAYS FINALIZED A CONTRACT WITH THE UNIVERSITY OF ILLINOIS' NCSA TO PROVIDE THE SUPERCOMPUTERCRAY INC <CRAY.O> SAYS FOR 2011, ITS OUTLOOK REMAINS THE SAME AS STATED ON NOVEMBER 1, 2011BRIEF-Cray Inc says gets $188 mln contract AMD to Present at Barclays Capital Global Technology Conference <AMD.N>FITCH AFFIRMS ADVANCED MICRO DEVICES' IDR AT 'B'; REVISES OUTLOOK TO POSITIVETEXT-Fitch revises Advanced Micro DevicesCollaboration between A*STAR Institute of Microelectronics, GLOBALFOUNDRIES and Alcatel-Lucent to Bring Advanced Photonics Chips to Market <ALU.N><ALU.PA><AMD.N> AMD Memory Brand Introduced for Entertainment, Performance and Enthusiast Desktop Computers <AMD.N>"
2011,12," AMD to Present at Raymond James IT Supply Chain Conference <AMD.N>NextOp and Leading Semiconductor Design Company Sign Multi-Year Licensing Deal for BugScope Assertion Synthesis Technology <AMD.N> AMD Announces Fusion12 Developer Summit <AMD.N>CITIGROUP REMOVES AMD <AMD.N> FROM TOP PICKS LIVE LISTAMD TO APPOINT DR. LISA SU AS SENIOR VICE PRESIDENT AND GENERAL MANAGER, GLOBAL BUSINESS UNITS AMD to Appoint Dr. Lisa Su as Senior Vice President and General Manager, Global Business Units <AMD.N>Credorax and AMD Bring NextGen Payment Processing to Online Merchants and IPSPs <AMD.N>"
