2007,1,"GOLDMAN RAISES TEXAS INSTRUMENTS <TXN.N>, MICRON TECHNOLOGY <MU.N> TO NEUTRAL FROM SELLRESEARCH ALERT-BofA raises Intel's Q4, 2007 earnings viewsAMD Unveils the First and Only Premium High-Definition TV Experience for PCs with... <AMD.N>AMD Ignites Consumer Passions With New AMD LIVE!(TM) Notebook PC, Home Cinema and... <AMD.N>US RESEARCH NEWS-Prudential ups Northrop Grumman price targetAMD 'Better by Design' Program Enables PC Manufacturers to Deliver Ultimate Solutions for Windows Vista(TM)AMD Announces Development of DTX Open Standard to Help Enable Broad Adoption of Small... <AMD.N>AMD Announces Development of DTX Open Standard to Help Enable Broad Adoption of Small Form Factor PCsPodShow to Unveil PodShowTV for AMD LIVE!(TM) Entertainment Suite at CES <AMD.N><AMD.N> PodShow to Unveil PodShowTV for AMD LIVE!(TM) Entertainment Suite at CESAMD Updates Fourth Quarter Outlook <AMD.N>ADVANCED MICRO DEVICES INC <AMD.N> SAYS SEES Q4 OPERATING INCOME, EXCLUDING ATI-RELATED SEGMENTS AND ACQUISITION-RELATED CHARGES, TO BE POSITIVE BUT SUBSTANTIALLY LOWER THAN Q3AMD warns of revenue shortfall citing lower pricesUPDATE 1-AMD sees Q4 rev below analysts' estimatesUPDATE 2-AMD sees Q4 rev below analysts' estimatesCORRECTED-AMD warns of revenue shortfall citing lower pricesUS STOCKS-Futures slip on tech woes; AMD warnsAMD <AMD.N> SHARES TUMBLE 8.3 PCT to $18.50 IN PREMARKET TRADING AFTER REVENUE  OUTLOOK DISAPPOINTS  US RESEARCH NEWS-Morgan Stanley cuts Sun-theflyonthewall.comBefore the Bell - AMD shares slide on revenue shortfallUS STOCKS-Futures fall after AMD warns on revenueRPT-US STOCKS-Futures fall after AMD warns on revenueUS STOCKS-Wall St. set to fall on AMD warning, dataAMD shares slump after sales forecast cutUS STOCKS-Indexes flat as AMD warns, crude risesAMD Awarded a Technical and Engineering Emmy for Graphics Excellence <AMD.N>US STOCKS-Indexes rise with energy shares, techHEADLINE STOCKS - U.S. stocks on the move on Jan. 12AMD warning shows processor momentum shiftingRaritan and TYAN Computer Introduce New Technologies Leveraging AMD's Open-Platform... <AMD.N>Intel Q4 profit beats estimatesUPDATE 3-Intel profit falls, stock drops on margin outlookEU COMMISSION STAFF SEEK PERMISSION TO PREPARE NEW  INTEL <INTC.O> ANTITRUST CHARGES-SOURCEEU antitrust experts seek charges vs Intel-sourceRESEARCH ALERT-UBS cuts 2007 earnings view on IntelUPDATE 1-INTERVIEW-ASML CEO still sees good PC businessHEADLINE STOCKS - U.S. stocks to watch Jan 22UPDATE 1-Sun Micro confirms will use some Intel chipsFSMLabs Brings Hard Real-Time Linux and BSD to MySQL's Partner Program <AMD.N>US STOCKS-Nasdaq briefly turns negative as oil prices jumpAMD Reports Fourth Quarter and Annual Results <AMD.N>ADVANCED MICRO DEVICES INC <AMD.N> Q4 SHR LOSS $1.08ADVANCED MICRO DEVICES INC <AMD.N> Q4 REVENUE $1.77 BLNADVANCED MICRO DEVICES INC <AMD.N> REUTERS ESTIMATES Q4 REV VIEW $1,738.71 MLNADVANCED MICRO DEVICES INC <AMD.N> SEES Q1 REVENUE $1.6 BILLION TO $1.7 BILLIONAMD SAYS Q4 EPS INCLUDES ACQUISITION-RELATED AND INTEGRATION CHARGES OF $550 MILLION, OR $1.04/SHR, AND $27 MILLION OF EMPLOYEE STOCK-BASED COMPENSATION EXPENSE, OR $0.05/SHRAMD shows 4th qtr loss on merger costsUPDATE 1-Sun Microsystems swings to quarterly profitAMD <AMD.N> SHARES FALL 5.4 PCT TO $16.57 IN EXTENDED TRADE AFTER POSTING LOSS     After the Bell - AMD falls after posting lossAMD <AMD.N> CEO SAYS PC PROCESSOR PRICING WILL BE 'VERY  CHALLENGING' ALL YEAR  AMD sees 'challenging' pricing through 2007AMD <AMD.N> EXPECTS GROSS MARGIN TO IMPROVE IN 1ST QUARTER FROM  4TH QUARTER -COO MEYER  UPDATE 2-Sun Microsystems swings to quarterly profitUPDATE 3-Sun Microsystems turns profit after 5 qtrs in redAMD Continues to Give Embedded Designers More Choice With Addition of Two Mobile... <AMD.N>US RESEARCH NEWS-Baird starts Altra Holdings on outperformUPDATE 1-RESEARCH ALERT-Friedman cuts Advanced Micro DevicesUPDATE 1-RESEARCH ALERT-Credit Suisse downgrades Advanced MicroUS RESEARCH NEWS-UBS cuts Advanced Micro price targetUS RESEARCH NEWS-Prudential cuts Advanced Micro price targetAMD seals deal to supply China's TCL ComputerANALYSIS-AMD expansion questioned after gloomy quarterBreakthrough not seen altering microchip arms raceAMD and Microsoft Collaboration Enables World-class Windows Vista(TM) Experience <AMD.N>VisualOn Collaborates with AMD to Bring Exceptional Video and Audio to AMD Enabled... <AMD.N>UPDATE 1-AMD takes more market share from Intel"
2007,2,"GLOBAL CHIP SALES HIT RECORD $247.7 BILLION IN 2006THE SEMICONDUCTOR INDUSTRY ASSOCIATION SAYS GLOBAL SALES OF SEMICONDUCTORS REACHED $247.7 BILLION IN 2006, AN INCREASE OF 8.9 PERCENTSIA SEES 10 PERCENT GROWTH TO $273.8 BILLION IN WORLDWIDE SALES IN 2007Intel denies accusations in investor suit vs DellINTERVIEW-New AMD manfucturing chief says new chips on trackAMD Appoints Douglas Grose to Lead Worldwide Technology Development and Manufacturing... <AMD.N>AMD Appoints Douglas Grose to Lead Worldwide Technology Development and Manufacturing OperationsNew AMD Opteron(TM) Processors Unveiled for Ultimate Datacenter Performance-Per-Watt <AMD.N>Capital Re boosts stake in AMD to 4.5 pctAMD Details Native Quad-core Design Features for Breakthrough Performance and Advanced... <AMD.N>AMD Details Native Quad-core Design Features for Breakthrough Performance and Advanced Power Efficiencies<AMD.N> Ulticom Partners with AMD to Deliver High-Performance Signaling Solutions for Telecommunication NetworksAMD Ushers in Breathtaking Multimedia for Mobile Devices With Next-Generation AMD... <AMD.N> Ulticom Partners With AMD to Deliver High-Performance Signaling Solutions for Telecommunication NetworksAMD sees first fruits of ATI integration in 2009AMD Offers New Products, Expands AMD64 Longevity Program to Further Support Embedded... <AMD.N>AMD to License Graphics Technology Optimized for Handheld Devices <AMD.N>AMD Offers New Products, Expands AMD64 Longevity Program to Further Support Embedded MarketSeven Summits Research Releases Comments on AMD, NYX, CEPH, AL, and EDS <EDS.N><AMD.N><CEPH.O><NYX.N>Study Commissioned by AMD Reveals Scope of Annual U.S. Data Center Energy Consumption:... <AMD.N>AMD Opens Developer Pavilion to Promote Collaboration and Innovation in Second Life... <AMD.N>New AMD Desktop Processors Designed for Both Performance-Hungry and Energy-Conscious... <AMD.N>AMD <AMD.N> CEO SAYS CONSENSUS UNDERESTIMATES IMPACT OF WINDOWS  VISTA  UPDATE 1-AMD chief says Vista impact underestimatedNext Inning Technology Updates Outlooks for Avici Systems, Advanced Micro Devices,... <CREE.O><AMD.N><AVCID.O><INTC.O>APPLIED MATERIALS CEO EXPECTS INTEL <INTC.O>, AMD <AMD.N> PRICE  WAR TO CONTINUE  APPLIED MATERIALS CEO SEES FLASH BIT GROWTH OF 150 PCT IN 2007,  DRAM BIT GROWTH OF 70-90 PCT  APPLIED MATERIALS CEO SEES WAFER FAB EQUIPMENT SPENDING UP 4-6  PERCENT IN 2007  Appro Unleashes Four Processor Workstation with Industry Leading 128GB Memory for... <AMD.N>STOCKS NEWS US-AMD shares rise on buyout chatterNew AMD Platform Integrates ATI Graphics for The Ultimate Visual Experience(TM) For... <AMD.N>AMD to Present at Morgan Stanley Technology Conference <AMD.N>"
2007,3,"AMD Demonstrates Accelerated Computing Solution that Breaks Teraflop Barrier <AMD.N>ADVANCED MICRO DEVICES INC <AMD.N> SAYS UNLIKELY TO MEET ITS PREVIOUSLY ESTIMATED Q1 REVENUE GUIDANCE OF $1.6-$1.7 BLNADVANCED MICRO DEVICES INC <AMD.N> REUTERS ESTIMATES Q1 REV VIEW $1,653.81 MLNAMD says unlikely to meet revenue forecastUPDATE 2-AMD says unlikely to meet revenue forecastUS RESEARCH NEWS- Prudential cuts Advanced Micro price targetAMD CEO SAYS Q1 REVENUE WEAKNESS DUE TO LOSING BUSINESS IN  DISTRIBUTION CHANNEL  AMD CEO SAYS EXPECTS TO REGAIN PREVIOUS DISTRIBUTION CHANNEL  POSITION  AMD says weakness due to distribution channelNvidia expects to gain notebook market share Cray Supports New Low-Power AMD Opteron Processors Fujitsu Introduces the Enterprise-Class, Thin and Light LifeBook S2210 Notebook Powered by AMD Turion 64 X2 Dual-CoreNvidia shares rise on market share expectationsAMD Drives Industry Efforts to Enable Console-Quality Games for Handheld Devices <AMD.N>U.S. judge orders Intel to try to recover e-mailsAMD and Solution Partners Strengthen CMP Technology's SmallBizResource.com <AMD.N>AMD and Architecture for Humanity Announce World's Largest Architecture Prize at... <AMD.N>TEXT-Moody's release on Advanced Micro DevicesDigital Entertainment Experiences Made Simpler With New AMD LIVE!(TM) Ready Program <AMD.N>NASDAQ SAYS MATCHED MARKET SHARE IN NYSE-LISTED SECURITIES WAS 14.5 PCT IN FEBRUARY VS 7 PCT IN FEBRUARY 2006Nasdaq's February share of NYSE stocks 14.5 pctPC Industry Rallying Behind DTX Specification to Enable Small Form Factor Adoption <AMD.N>UPDATE 1-AMD jumps to 8th-biggest chipmaker from 15thWombat Increases Predictability and Performance of Automated Trading Environments... <CSCO.O><AMD.N> Cray, AMD and CSC Announce Grant Program to Benefit Young Finnish Computational Science ResearchersIntel confirms $2.5 bln, 300mm-wafer China plantUPDATE 1-Intel to build $2.5 bln, 300mm-wafer China plantAMD Promotes Industry Standards and Interoperability with New Testing Tools for Desktop... <AMD.N>New AMD Platform Advances the Windows Vista(TM) Premium Experience for Mobile Computing <AMD.N>"
2007,4,"AMD Strengthens Embedded Offerings with Graphics Chipset, Development Board for Embedded... <AMD.N>Nedbank Group and AMD Partner to Narrow the Digital Divide in South Africa <AMD.N>AMD Imageon(TM) Media Processor Drives Multimedia Technology Behind Avant-Garde New... <AMD.N>Silicon Valley Leadership Group and AMD to Host U.S. Senator Barbara Boxer and Silicon... <AMD.N>AMD Updates First Quarter Outlook <AMD.N>AMD UPDATES FIRST QUARTER OUTLOOKADVANCED MICRO DEVICES INC <AMD.N> SEES Q1 REV ABOUT $1.23 BLNADVANCED MICRO DEVICES INC <AMD.N> SAYS WILL REDUCE 2007 CAPITAL EXPENDITURES BY APPROXIMATELY $500 MILLIONADVANCED MICRO DEVICES SAYS WILL ALSO SIGNIFICANTLY REDUCE DISCRETIONARY EXPENSES AND LIMIT HIRING TO CRITICAL POSITIONSADVANCED MICRO DEVICES INC <AMD.N> SAYS CAP EX REDUCTION WILL NOT MATERIALLY IMPACT CAPACITY PLANS FOR THE YEARADVANCED MICRO DEVICES <AMD.N> SHARES UP 2.3 PERCENT TO $13.15  AMD sees 1st-qtr revenue below Wall Street viewSTOCKS NEWS US-AMD sees 1st-qtr revenue below Wall Street viewUPDATE 1-AMD sees revenue below view, plans overhaulUS STOCKS-Indexes flat as earnings jitters offsets jobsUPDATE 2-AMD sees revenue below view, plans overhaulUPDATE 3-AMD sees revenue shortfall, cuts spending plansUS STOCKS-Indexes end flat on deals; Dow Chemical denies talkPRESS DIGEST - Wall Street Journal - April 10Kulabyte and AMD to Demonstrate World's Fastest Video Encoding Solution At NAB 2007 <AMD.N>CORRECTING and REPLACING Kulabyte and AMD to Demonstrate World's Fastest Video Encoding... <AMD.N>UBS CUTS INTEL <INTC.O> 2007 Q1 SHR VIEW TO $0.20 FROM $0.22; KEEPS BUYUPDATE 1-RESEARCH ALERT-UBS cuts Q1 profit view on IntelNASDAQ STOCK MARKET INC <NDAQ.O>SAYS MARKET SHARE IN ALL U.S. EQUITY SECURITIES ROSE TO 28.8 PCT IN MARCHIntel may have upper hand in processor war, for nowIntel says new chips up to 40 pct fasterSony Creative Software Partners With AMD to Host Technology Preview of 64-Bit Version... <AMD.N>UPDATE 1-Intel says new chips about 40 pct fasterUDPATE 1-Intel quarterly profit rises, helped by tax itemUPDATE 1-Intel quarterly profit rises, helped by tax itemUPDATE 3-Intel profit rises, margin outlook raisedUPDATE 1-RESEARCH ALERT-JP Morgan ups Intel rating, '07 EPS viewRESEARCH ALERT-Merrill widens AMD second-quarter loss forecastAMD Reports First Quarter Results <AMD.N>ADVANCED MICRO DEVICES INC <AMD.N> Q1 SHR LOSS $1.11ADVANCED MICRO DEVICES INC <AMD.N> Q1 REVENUE $1.23 BLNADVANCED MICRO DEVICES INC <AMD.N> REUTERS ESTIMATES Q1 SHR VIEW $-0.47ADVANCED MICRO DEVICES INC <AMD.N> REUTERS ESTIMATES Q1 REV VIEW $1,225.68 MLNADVANCED MICRO DEVICES INC <AMD.N> SAYS IN THE SEASONALLY DOWN SECOND QUARTER, AMD EXPECTS REVENUE TO BE FLAT TO SLIGHTLY UPADVANCED MICRO DEVICES SAYS GROSS MARGIN OF 31 PERECNT EXCLUDES CHARGES, STOCK-BASED COMPENSATION EXPENSEAMD <AMD.N> SAYS LOWER MARGINS DUE TO LOWER MICROPROCESSOR UNIT SHIPMENTS, LOWER AVERAGE SELLING PRICES, AND INCLUSION OF FORMER ATI OPERATIONSAMD posts quarterly loss amid Intel price warAdvanced Micro <AMD.N> news releaseAMD <AMD.N> SHARES FALL 9 PCT IN ELECTRONIC TRADE AFTER POSTING  BIGGER-THAN-EXPECTED QUARTERLY LOSS  AMD <AMD.N> CONTINUES TO EVALUATE WIDE RANGE OF FINANCING  OPPORTUNITIES -CFO  AMD <AMD.N> SHARES REBOUND FROM INITIAL FALL AFTER RESULTS, RISE 1.2 PCT TO  $14.45 IN EXTENDED TRADE  UPDATE 2-AMD shows surprisingly big loss in quarterAfter the Bell - AMD shares rebound after resultsAMD <AMD.N> SAYS 'COMPLETELY OPEN' TO PRIVATE EQUITY FINANCING  OPTIONS  UPDATE 3-AMD shows big loss but says open to financingUPDATE 4-AMD shows big loss but open to private equityUPDATE 5-AMD posts big loss, seeks ways to raise capitalUS RESEARCH NEWS-Credit Suisse raises Activision target to $25AMD fund-raising restricted by past debt dealAMD Marks AMD64 Anniversary with Widespread Availability of New Highest-Performing... <AMD.N>TEXT-S&P release on Advanced Micro DevicesAdvanced Micro Devices, Inc. to Offer $1.8 Billion of Convertible Senior Notes <AMD.N>ADVANCED MICRO DEVICES, INC. TO OFFER $1.8 BILLION OF CONVERTIBLE SENIOR NOTESADVANCED MICRO DEVICES INC <AMD.N> SAYS EXPECTS TO ENTER INTO CAPPED CALL TRANSACTIONS WHICH ARE INTENDED TO REDUCE POTENTIAL DILUTIONADVANCED MICRO DEVICES INC <AMD.N> SAYS TO USE AT LEAST $500 MLN IN PROCEEDS TO REPAY LOAN USED TO BUY ATIAdvanced Micro to sell $1.8 bln debt after S&P cutTEXT-Moody's changes AMD outlook to negativeMMNEWS-Advanced Micro Devices' bonds slideAdvanced Micro Devices, Inc. Prices $2 Billion of 6.00% Convertible Senior Notes... <AMD.N>ADVANCED MICRO DEVICES, INC. PRICES $2 BILLION OF 6.00% CONVERTIBLE SENIOR NOTES DUE 2015Advanced Micro Devices prices senior notes offeringS&P AFFIRMS B CCR ON AMD; SR UNSEC CONVRT DEBT RATED B-Dell, AMD Partner for 'Plant a Tree for Me' <AMD.N><DELL.O>Intel market share jumps in 1st qtrUS CORP BONDS-Spreads steady; issuers step up supplyFITCH RATINGS REVISES AMD'S OUTLOOK TO NEGATIVE; AFFIRMS IDR AT 'B'TEXT- Fitch ratings revises AMD's outlook to negativeINSTANT VIEW 3-Apple profit beats expectations, shares jumpAMD to Webcast Annual Meeting of Stockholders <AMD.N>Advanced Micro Devices, Inc. Closes $2.2 Billion Offering of Convertible Senior Notes <AMD.N>MOODY'S AFFIRMS AMD'S B1 CFR, REVISES SECURED DEBT TO BA2; OUTLOOK NEGATIVEMOODY'S AFFIRMS ADVANCED MICRO DEVICES INC <AMD.N> B1 CORPORATE FAMILY RATING"
2007,5,"AMD Delivers the Ultimate Mobile Platform with New 65nm AMD Turion(TM) 64 X2 Dual-Core... <AMD.N>Seven Summits Research Releases Comments on AMD, X, BA, RIO, and POT <VALE5.SA><AMD.N><BA.N><X.N>UPDATE 2-France's Soitec sees flat 1st halfRed Hat teams up with Intel on desktop softwareAMD shares rise on bullish Nvidia commentsAMD unveils new graphics chip, high-end brandAMD Names the Next PC Computing Thrill Ride: The AMD Phenom(TM) Processor <AMD.N>AMD Introduces the ATI Radeon(TM) HD 2000 Series, Delivering The Ultimate Visual... <AMD.N>UPDATE 1-NEC Electronics forecasts 3rd straight annual lossTech Mahindra, Sun Micro India in Internet TV pactWALL STREET - Spås öppna oförändratRESEARCH ALERT-American Technology raises Advanced Micro DevicesUS RESEARCH NEWS-Merrill Lynch raises Caterpillar price targetAMD Releases Expanded Tools and Support for Developers to Fully Utilize Three Generations... <AMD.N>Reuters Summit-Intel to maintain 82-83 pct Asia market shareU.S. INT'L TRADE COMMISSION SAYS BEGINS INVESTIGATION OF COMPUTER CHIP PATENTS AT REQUEST OF TESSERAAMD Details Next-Generation Platform for Notebook PCs <AMD.N>AMD Chooses TSMC 65nm Process for GPU Product Line <AMD.N>ATI Radeon(TM) HD 2900 XT Sets New Performance Record In 3DMARK(R)05 Benchmark <AMD.N>US RESEARCH NEWS-Matrix raises Sun Microsystems to holdUPDATE 3-Dell to sell PCs at Wal-Mart in retail pushUPDATE 2-Toshiba to use AMD chip in laptop PCsToshiba Taps AMD Platform for New Notebooks <AMD.N>Toshiba Adds AMD Processors to Satellite Notebook Series <AMD.N>Fanless Embedded Designs Can Now Take Advantage of AMD64 Technology with the Introduction... <AMD.N>"
2007,6,"AMD Empowers PC Industry to Deliver Innovative Small Form Factor Solutions With DTX... <AMD.N>AMD Validated Server Program Partners Unveil First Platforms Demonstrating Upcoming... <AMD.N>Intel, Asustek announce plans for low-cost laptopTAIPEI-AMD <AMD.N> AIMS TO REVERSE GLOBAL MARKET SHARE DECLINE BY  YEAR-END -EXEC  INTERVIEW-AMD aims to reverse market share slide by yr-endAMD LIVE!(TM) Home Cinema Brings Home Stunning Digital Entertainment <AMD.N>AMD shares fall on report of chip delayREFILE-ANALYSIS-Gadgets help China chip designers, but how long?US RESEARCH NEWS-AG Edwards ups Genesis Energy price targetAMD shares rise after Lehman stock target hikeUPDATE 1-Dell to sell notebook PCs at US Sam's Club storesCORRECTED - (OFFICIAL)-Sam's Club says to sell Dell notebook PCs for $899ATI Radeon(TM) 2400 and ATI Radeon(TM) 2600 Now Shipping to Board Customers <AMD.N>World's Leading Stock Exchanges Trust AMD Opteron(TM) Processors for their Mission-critical... <AMD.N>Intel to update high-end Itanium server chipsGOLDMAN SACHS RAISES INTEL <INTC.O> TO BUY FROM NEUTRALRESEARCH ALERT-Goldman Sachs raises Intel to buyUPDATE 1-RESEARCH ALERT-Goldman Sachs ups Intel to buyRAYMOND JAMES RESUMES INTEL <INTC.O> WITH STRONG BUY RATINGNextComputing Introduces Processor Modularity on its Family of Flextop Computers,... <AMD.N>ADVANCED MICRO DEVICES <AMD.N> SHARES RISE 1.4 PCT TO $13.83 BEFORE THE BELL AFTER  BROKER UPGRADE  Nvidia shares rise on margin outlook, new productSTOCKS NEWS US-Wall St indexes rise as tech stocks advanceSTOCKS NEWS US-Advanced Micro upgrade fuels interest in callsSTOCKS NEWS ASIA-Chip stocks rise but markets slipRESEARCH ALERT-JP Morgan cuts Soitec price targetAMD Unleashes The ATI Radeon(TM) HD 2600 and ATI Radeon(TM) HD 2400 Series, Delivering... <AMD.N>US STOCKS-Futures flat before Fed, dataUS STOCKS-Futures slip as core inflation perks upUS STOCKS-Indexes up a bit as investors await Fed's rate moveNext Inning Technology Publishes State of Tech Report: Updates Outlooks for Intel,... <NVDA.O><AMD.N><INTC.O>AMD to sell new server processor in August"
2007,7,"AMD Makes Strategic Investment in Transmeta <AMD.N><TMTA.O>AMD Offers the Ultimate HDTV and DVR Home Theater Experience for Notebook and Desktop... <AMD.N>UPDATE 1-RESEARCH ALERT-UBS raises Intel price target to $30AMD To Webcast Special Meeting Of Stockholders <AMD.N>AMD Announces the Resignation of Dave Orton, former CEO of ATI <AMD.N>AMD Announces the Resignation of Dave Orton, former CEO of ATIRESEARCH ALERT-Banc of America raises Intel price targetUPDATE 1-RESEARCH ALERT-BofA ups Intel estimates, price targetCITIGROUP RAISES INTEL <INTC.O> PRICE TARGET TO $31 FROM $27; KEEPS BUY RATINGRESEARCH ALERT-Citigroup raises Intel price target to $31 General Software Provides Embedded BIOS(R) With StrongFrame(TM) Technology for the AMD Geode(TM) LX UVC ReferenceUPDATE 1-Intel quarterly profit rises, but margins missCORRECTED-Intel second-quarter profit risesUPDATE 2-Intel quarterly profit rises, but margins missUPDATE 4-Intel proft margin woes overshadow earnings riseEU clears 262 mln euros German aid for AMDBrokers up Intel price targets even as shares fallAMD REPORTS SECOND QUARTER RESULTSAMD Reports Second Quarter Results <AMD.N>ADVANCED MICRO DEVICES INC <AMD.N> Q2 REVENUE $1.38 BLNAMD SAYS Q2 RESULTS INCLUDE AN IMPACT OF $130 MILLION, OR $0.24 PER SHAREADVANCED MICRO DEVICES INC <AMD.N> REUTERS ESTIMATES Q3 REV VIEW $1,391.30 MLNADVANCED MICRO DEVICES <AMD.N> SHARES RISE 4.6 PCT TO $16.50 IN EXTENDED TRADE  AFTER REPORTS RESULTS  INSTANT VIEW 5-Google, Microsoft profits upUPDATE 1-AMD posts 2nd-quarter loss amid price warSTOCKS NEWS-Advanced Micro Devices shares rise after resultsCORRECTED-AMD <AMD.N> SAYS 2007 CAPITAL SPENDING WILL BE $1.8 BLN,  10 PCT (NOT 20 PCT) BELOW EARLIER FORECAST  AMD expects profit margin to improve in third quarterUPDATE 2-AMD posts 2nd-qtr loss but sales up, boosting shrsUS RESEARCH NEWS-Nollenberger starts Aeropostale with buyEXCLUSIVE-Nonprofit may launch $350 laptop by ChristmasAMD to Hold Technology Analyst Day <AMD.N>AMD Renews Commitment to Climate Protection; Surpasses 2007 Goal to Decrease Greenhouse... <AMD.N>AMD Unveils Forward-Looking Technology Innovation to Extend Memory Footprint for... <AMD.N>EXCLUSIVE-UPDATE 1-EU issues charges against Intel-sourcesEXCLUSIVE-UPDATE 2-EU says issues charges against IntelEU COMMISSION SAYS INTEL <INTC.O> COMMITTED 3 TYPES OF ANTITRUST ABUSE  EU COMMISSION SAYS INTEL MAKES REBATES CONDITIONAL ON KEEPING MOST BUSINESS AWAY FROM RIVALUPDATE 1-EU says Intel made 3 kinds of antitrust violationsIntel defends itself against EU antitrust chargesUPDATE 1-Intel says EU made errors in antitrust chargesINTEL CORP <INTC.O>SAYS COMMISSION'S DECISION TO ISSUE STATEMENT OF OBJECTIONS MEANS THAT AT LAST IT WILL HAVE THE OPPORTUNITY TO HEAR AND RESPOND TO ALLEGATIONS MADE BY PRIMARY COMPETITOREuropean Commission Charges Intel with Antitrust ViolationsAdvanced Micro Devices <AMD.N>. For more news, click on [AMD.N]UPDATE 4-EU says Intel tried to squeeze out Advanced MicroEuropean Commission (EC) Charges Intel with Antitrust Violations <AMD.N>EUROPEAN COMMISSION (EC) CHARGES INTEL WITH ANTITRUST VIOLATIONSUPDATE 1-Sun Micro posts 4th-qtr profit vs loss"
2007,8,"New Economic Study Finds Intel Extracted Monopoly Profits of $60 Billion Since 1996CARIS RESUMES INTEL <INTC.O>, TEXAS INSTRUMENTS <TXN.N>, NATIONAL SEMICONDUCTOR <NSM.N>, ALL WITH ABOVE AVERAGE RATINGSEMICONDUCTOR INDUSTRY ASSOCIATION SAYS Q2 SALES OF $59.9 BLN DECLINED BY 2 PCT FROM THE $61.1 BLN REPORTED IN Q1 OF 2007Semiconductor sales fall on lower pricesAMD Unveils Innovation-Packed Series of ATI FireGL(TM) Workstation Graphics Accelerators <AMD.N>Compilers Target Quad-Core AMD Opteron(TM) Processors <AMD.N>Advanced Micro Devices, Inc. to Offer $1.5 Billion of Convertible Senior Notes <AMD.N>Advanced Micro Devices to offer $1.5 bln of notesAMD Announces Broad Software Ecosystem Support for Industry's First x86 Native Quad-Core... <AMD.N>ADVANCED MICRO DEVICES, INC. PRICES $1.5 BILLION OF 5.75% CONVERTIBLE SENIOR NOTES DUE 2012Advanced Micro Devices, Inc. Prices $1.5 Billion of 5.75% Convertible Senior Notes... <AMD.N>ADVANCED MICRO DEVICES INC <AMD.N> SAYS INITIAL CONVERSION RATE EQUIVALENT TO AN INITIAL CONVERSION PRICE OF ABOUT $20.13 PER SHAREADVANCED MICRO DEVICES INC <AMD.N> SEES NET PROCEEDS FROM OFFERING TO BE ABOUT $1,479 MILLIONMMNEWS-US junk bonds off lows; AMD sells $1.5 bln notesFITCH RATES AMD'S CONVERTIBLE SR. NOTES 'CCC+/RR6'; AFFIRMS IDR AT 'B'; OUTLOOK NEGATIVES&P AFFIRMS B CORP CREDIT RATING ON ADVANCED MICRO DEVICES INC.AMD Releases Specification Designed to Enable Real-Time Performance Optimization... <AMD.N>Advanced Micro Devices, Inc. Closes $1.5 Billion Offering of 5.75% Convertible Senior... <AMD.N>ADVANCED MICRO DEVICES, INC. CLOSES $1.5 BILLION OFFERING OF 5.75% CONVERTIBLE SENIOR NOTES DUE 2012CREDIT SUISSE ASSUMES QIMONDA <QI.N> WITH OUTPERFORM RATING; PRICE TARGET OF $20AMD Empowers Channel Partners with New Product and AMD Validated Solutions Program... <AMD.N>UPDATE 3-Tech Data posts quarterly profit, shares riseUPDATE 1-AMD sales chief Richard to leave company-CNETADVANCED MICRO DEVICES, INC. <AMD.N> SAYS RICHARD LEAVING COMPANY IN SEPTEMBER 2007ADVANCED MICRO DEVICES, INC. <AMD.N> SAYS RICHARD DEPARTS OF HIS OWN ACCORD AND ON COMPLETELY AMICABLE TERMSJapan July chip equipment orders -12.3 pct yr/yrSTOCKS NEWS US-Advanced Micro pricey puts may be a bearish signAMD Highlights Hardware Feature Key to Managing Virtualized IT Infrastructures <AMD.N>AMD to Boost Performance for Everyday Compute-Intense Multimedia, Security and High... <AMD.N>AMD Beats Intel in 36 of 57 Power Efficiency Tests by Neal Nelson <AMD.N>"
